VideoID,Decription
nTUONeDqhdk_10_15.avi,kid falls over in hockey equipment
nTUONeDqhdk_10_15.avi,kid falls over
nTUONeDqhdk_10_15.avi,kid knocks himself over
nTUONeDqhdk_10_15.avi,person plays with hockey stick
nTUONeDqhdk_10_15.avi,small kid wearing cricket leg pads and holding cricket bat barely manages to walk and falls on the ground
nTUONeDqhdk_10_15.avi,young child is dressed as hockey goalie and when he tries to move he falls down
nTUONeDqhdk_10_15.avi,someone small in hockey gear and padding falls down
nTUONeDqhdk_10_15.avi,the boy in all of the goalie gear fell over
nTUONeDqhdk_10_15.avi,the boy in the goalee gear fell over
nTUONeDqhdk_10_15.avi,the boy wearing hockey gear fell down
nTUONeDqhdk_10_15.avi,kid performing hocky keeper
nTUONeDqhdk_10_15.avi,small child in hockey clothes falls down
nTUONeDqhdk_10_15.avi,little kid falls because the hockey goalie equipment is too heavy
nTUONeDqhdk_10_15.avi,the funny kid is sweeping the road
nTUONeDqhdk_10_15.avi,child playing hockey collapses
nTUONeDqhdk_10_15.avi,small kid is holding the hockey bat
nTUONeDqhdk_10_15.avi,child falling down
nTUONeDqhdk_10_15.avi,little kid is wearing too much hockey goalie gear and falls over
nTUONeDqhdk_10_15.avi,joker is cleaning hall
nTUONeDqhdk_10_15.avi,little kid falls over
nTUONeDqhdk_10_15.avi,someone doing something
nTUONeDqhdk_10_15.avi,child in hockey padding falls down
nTUONeDqhdk_10_15.avi,kid fell down
nTUONeDqhdk_10_15.avi,extremely funny kids
nTUONeDqhdk_10_15.avi,baby falls down
nTUONeDqhdk_10_15.avi,someone is doing something
nTUONeDqhdk_10_15.avi,baby doing some funny acts
nTUONeDqhdk_10_15.avi,little boy is playing hockey and falls over
nTUONeDqhdk_10_15.avi,kid is playing some game
nTUONeDqhdk_10_15.avi,funny kids
nTUONeDqhdk_10_15.avi,kid is wearing funny cloths
nTUONeDqhdk_10_15.avi,child wearing hockey equipment falls over
nTUONeDqhdk_10_15.avi,kid in hockey gear falls over
OO-5-eVEKPA_25_31.avi,young girl seated on stage is playing babygrand piano
OO-5-eVEKPA_25_31.avi,girl is playing piano
OO-5-eVEKPA_25_31.avi,little girl is playing the piano
OO-5-eVEKPA_25_31.avi,little girl is playing grand piano on stage
OO-5-eVEKPA_25_31.avi,little girl is playing piano
OO-5-eVEKPA_25_31.avi,girl is playing the piano
OO-5-eVEKPA_25_31.avi,the little girl is performing piano recital
OO-5-eVEKPA_25_31.avi,girl plays the piano
OO-5-eVEKPA_25_31.avi,the little girl sat at the piano on stage and played
OO-5-eVEKPA_25_31.avi,the baby is playing the piano
OO-5-eVEKPA_25_31.avi,this lady is clearly over the hilli want youngereveryone knows you forget how to by the age of
OO-5-eVEKPA_25_31.avi,little girl is playing piano
OO-5-eVEKPA_25_31.avi,the little girl sat and played the piano on stage
OO-5-eVEKPA_25_31.avi,small girl is playing the piano
OO-5-eVEKPA_25_31.avi,the girl is playing the piano
l57mQZvDaL4_10_30.avi,cat is grooming large dog with its tongue
l57mQZvDaL4_10_30.avi,cat licks sleeping dogs head
l57mQZvDaL4_10_30.avi,dog and cat are sitting next to one another and the cat is licking the dogs head
l57mQZvDaL4_10_30.avi,cat is licking sleeping dog
l57mQZvDaL4_10_30.avi,cat is licking dogs face
l57mQZvDaL4_10_30.avi,cat is licking dog
l57mQZvDaL4_10_30.avi,cat is licking dogs head
l57mQZvDaL4_10_30.avi,cat licks dogs head
l57mQZvDaL4_10_30.avi,cat is cleaning dog
l57mQZvDaL4_10_30.avi,the cat licked the dogs head
l57mQZvDaL4_10_30.avi,the cat is licking the sleeping dogs head
l57mQZvDaL4_10_30.avi,cat grooms dog
l57mQZvDaL4_10_30.avi,cat and dog are playing
l57mQZvDaL4_10_30.avi,friendship with cat and dog
l57mQZvDaL4_10_30.avi,the cat is licking the dogs neck and the dog is enjoying is
l57mQZvDaL4_10_30.avi,the cat is playing with dog
l57mQZvDaL4_10_30.avi,dog and cat were friends
l57mQZvDaL4_10_30.avi,cat is licking dogs ear
l57mQZvDaL4_10_30.avi,cat is grooming dog with its tongue
l57mQZvDaL4_10_30.avi,cat is licking sleeping dog on the streetside
l57mQZvDaL4_10_30.avi,best friends dog and cat
l57mQZvDaL4_10_30.avi,dog sleeping the foot and near cat is dog had eaching
l57mQZvDaL4_10_30.avi,cat is licking dogs head
l57mQZvDaL4_10_30.avi,an animals are playing
l57mQZvDaL4_10_30.avi,the cat is licking the dogs head
l57mQZvDaL4_10_30.avi,cat is licking sleeping dog on his head
l57mQZvDaL4_10_30.avi,really super friendly dog and cat
D1X6qXkLjYE_41_49.avi,woman dancing in front of microphone begins to sing while accompanied by man on keyboard
D1X6qXkLjYE_41_49.avi,woman is dancing in front of microphone while man is playing keyboard instrument
D1X6qXkLjYE_41_49.avi,band is performing on stage out side
D1X6qXkLjYE_41_49.avi,woman is dancing while man plays the keyboard
D1X6qXkLjYE_41_49.avi,woman is dancing while man plays keyboard
D1X6qXkLjYE_41_49.avi,woman dances on stage
D1X6qXkLjYE_41_49.avi,the lady danced and sang on the grass to music
D1X6qXkLjYE_41_49.avi,woman is dancing on stage and man is playing keyboard
D1X6qXkLjYE_41_49.avi,woman dances while man plays the keyboard
D1X6qXkLjYE_41_49.avi,the girl danced to the music on the grass
D1X6qXkLjYE_41_49.avi,woman is dancing and singing while man plays piano
D1X6qXkLjYE_41_49.avi,the boy is playing the music ans girl is dancing
D1X6qXkLjYE_41_49.avi,woman dances while man plays keyboard
D1X6qXkLjYE_41_49.avi,girl dancing and singing
D1X6qXkLjYE_41_49.avi,the woman is dancing and singing
D1X6qXkLjYE_41_49.avi,excellent dancing girl
D1X6qXkLjYE_41_49.avi,man plays keyboards while woman sings and dances
UbmZAe5u5FI_88_98.avi,woman pours clear liquid on both sides of raw fish on plate with measuring spoon
UbmZAe5u5FI_88_98.avi,woman pours oil on fish
UbmZAe5u5FI_88_98.avi,woman is pouring water on fish
UbmZAe5u5FI_88_98.avi,woman is spooning seasoning over split fish in plate
UbmZAe5u5FI_88_98.avi,woman is adding oil on fishes
UbmZAe5u5FI_88_98.avi,woman is sprinkling oil on fish to get it ready for cooking
UbmZAe5u5FI_88_98.avi,woman is adding oil to fish
UbmZAe5u5FI_88_98.avi,woman is putting liquid onto some fish
UbmZAe5u5FI_88_98.avi,woman is pouring oil over fish
UbmZAe5u5FI_88_98.avi,woman is spreading oil over fish
UbmZAe5u5FI_88_98.avi,the woman is oiling the fish
UbmZAe5u5FI_88_98.avi,woman is sprinkling sake on mackerel fillet
UbmZAe5u5FI_88_98.avi,woman seasons some fish
UbmZAe5u5FI_88_98.avi,woman is sprinkling sake on fish
UbmZAe5u5FI_88_98.avi,the lady poured sauce on the fish
UbmZAe5u5FI_88_98.avi,women is cooking fish
UbmZAe5u5FI_88_98.avi,man is spreading the liquid on the fish
UbmZAe5u5FI_88_98.avi,someone is seasoning fish
UbmZAe5u5FI_88_98.avi,the woman is cooking recipe called hiyajiru
UbmZAe5u5FI_88_98.avi,woman is oiling some fish
UbmZAe5u5FI_88_98.avi,chef is seasoning raw horse mackerel
UbmZAe5u5FI_88_98.avi,woman is talking about the cooking recipe
UbmZAe5u5FI_88_98.avi,the woman poured oil on the fish
UbmZAe5u5FI_88_98.avi,woman sprinkles sake on butterflied fish
N2Cm0SLr0ZE_18_29.avi,boy is playing on guitar
N2Cm0SLr0ZE_18_29.avi,boy sits on bed sings and plays guitar
N2Cm0SLr0ZE_18_29.avi,child is playing guitar and singing
N2Cm0SLr0ZE_18_29.avi,child is playing guitar
N2Cm0SLr0ZE_18_29.avi,child plays the guitar
N2Cm0SLr0ZE_18_29.avi,little boy is playing guitar and singing
N2Cm0SLr0ZE_18_29.avi,little boy is playing guitar
N2Cm0SLr0ZE_18_29.avi,little boy is singing and playing guitar
N2Cm0SLr0ZE_18_29.avi,little kid is playing guitar and singing
N2Cm0SLr0ZE_18_29.avi,small baby is playing guitar
N2Cm0SLr0ZE_18_29.avi,small boy seated on the bed is holding guitar and humming tune
N2Cm0SLr0ZE_18_29.avi,young boy is singing while playing the guitar
N2Cm0SLr0ZE_18_29.avi,young boy sings and plays guitar
N2Cm0SLr0ZE_18_29.avi,the boy is singing and playing the guitar
N2Cm0SLr0ZE_18_29.avi,the boy played small guitar
N2Cm0SLr0ZE_18_29.avi,the little boy played small guitar
N2Cm0SLr0ZE_18_29.avi,the child is singing with guitar
N2Cm0SLr0ZE_18_29.avi,child playing musical instrument
N2Cm0SLr0ZE_18_29.avi,kid playing guitar
N2Cm0SLr0ZE_18_29.avi,boy is playing toy guitar and singing
N2Cm0SLr0ZE_18_29.avi,boy is playing guittier
N2Cm0SLr0ZE_18_29.avi,baby playing guitar
N2Cm0SLr0ZE_18_29.avi,kid play his music
N2Cm0SLr0ZE_18_29.avi,boy is playing music
N2Cm0SLr0ZE_18_29.avi,little boy singing while playing guitar
N2Cm0SLr0ZE_18_29.avi,music is so bad
Qwn0Ni9G5ow_64_69.avi,car traveling through the city
Qwn0Ni9G5ow_64_69.avi,bus designed to look like trolley is shown driving down street
Qwn0Ni9G5ow_64_69.avi,bus is running on the road
Qwn0Ni9G5ow_64_69.avi,red colored bus travels down road in the city
Qwn0Ni9G5ow_64_69.avi,streetcar driving by
Qwn0Ni9G5ow_64_69.avi,tourist bus is overtaking
Qwn0Ni9G5ow_64_69.avi,trolley is driving down the middle of the road
Qwn0Ni9G5ow_64_69.avi,trolley is driving through city
Qwn0Ni9G5ow_64_69.avi,trolley is going down the road
Qwn0Ni9G5ow_64_69.avi,trolley is going up the street
Qwn0Ni9G5ow_64_69.avi,trolley is moving down the street
Qwn0Ni9G5ow_64_69.avi,trolley moves down city street
Qwn0Ni9G5ow_64_69.avi,trolley rides down treelined street
Qwn0Ni9G5ow_64_69.avi,the bus drove down the street
Qwn0Ni9G5ow_64_69.avi,the bus drove into the city
Qwn0Ni9G5ow_64_69.avi,the trolley is going down the street
Qwn0Ni9G5ow_64_69.avi,charlottes is beautiful city for tour
Qwn0Ni9G5ow_64_69.avi,the people are playing in the garden
Qwn0Ni9G5ow_64_69.avi,bus runs inside city
Qwn0Ni9G5ow_64_69.avi,trolly is driving down the street
Qwn0Ni9G5ow_64_69.avi,bus is moving on the downtown street
Qwn0Ni9G5ow_64_69.avi,the bus going on road
Qwn0Ni9G5ow_64_69.avi,some people visting tour
Qwn0Ni9G5ow_64_69.avi,tourism bus is going be side the road
Qwn0Ni9G5ow_64_69.avi,video tour showing moving tram in city during the day
Qwn0Ni9G5ow_64_69.avi,bus is moving along street
Qwn0Ni9G5ow_64_69.avi,one bus going on the street
Qwn0Ni9G5ow_64_69.avi,bus is being driven down street
Qwn0Ni9G5ow_64_69.avi,trolley is driving down road
Qwn0Ni9G5ow_64_69.avi,mini bus is running on the road
Qwn0Ni9G5ow_64_69.avi,tram is shown in north carolina
Qwn0Ni9G5ow_64_69.avi,trolley is driving by
Qwn0Ni9G5ow_64_69.avi,man playing with his children
Qwn0Ni9G5ow_64_69.avi,the bus is moving on the street
Qwn0Ni9G5ow_64_69.avi,bus is running on road
Qwn0Ni9G5ow_64_69.avi,bus is moving on the road
Qwn0Ni9G5ow_64_69.avi,trolley car is moving down the street
Qwn0Ni9G5ow_64_69.avi,streetcar is going by
Qwn0Ni9G5ow_64_69.avi,trolley is moving down street
Qwn0Ni9G5ow_64_69.avi,tram in city is going by
Qwn0Ni9G5ow_64_69.avi,bus is moving
Qwn0Ni9G5ow_64_69.avi,street car is moving down the street
Qwn0Ni9G5ow_64_69.avi,unique tour of lady showing some sort of memorable scenes
Qwn0Ni9G5ow_64_69.avi,bus passing on the road
Qwn0Ni9G5ow_64_69.avi,trolley car is moving
Qwn0Ni9G5ow_64_69.avi,charlottes video of the tour
Qwn0Ni9G5ow_64_69.avi,the trolly is moving down the street
Qwn0Ni9G5ow_64_69.avi,bus is running
Qwn0Ni9G5ow_64_69.avi,showing the rating of something
Qwn0Ni9G5ow_64_69.avi,trolley is riding down city street
Qwn0Ni9G5ow_64_69.avi,bus moving on road
Qwn0Ni9G5ow_64_69.avi,the city of charlotte is described using few statistics
Qwn0Ni9G5ow_64_69.avi,charlottes family tour video
pptYu3YQnxY_160_170.avi,ingredients are being mixed in mixing bowl
pptYu3YQnxY_160_170.avi,lady mixed up batter
pptYu3YQnxY_160_170.avi,man is mixing batter
pptYu3YQnxY_160_170.avi,man mixes baking mixture
pptYu3YQnxY_160_170.avi,person is mixing bowl of ingredients
pptYu3YQnxY_160_170.avi,person mixes ingredients in bowl
pptYu3YQnxY_160_170.avi,woman is stirring cookie dough mixture
pptYu3YQnxY_160_170.avi,woman is whisking mixture of sugar butter and molasses in bowl using wooden spatula
pptYu3YQnxY_160_170.avi,woman preparing oatmeal cookies
pptYu3YQnxY_160_170.avi,cookie batter is being mixed
pptYu3YQnxY_160_170.avi,someone is using spoon to stir the ingredients of bowl
pptYu3YQnxY_160_170.avi,the lady mixed the ingredients together
pptYu3YQnxY_160_170.avi,the woman is mixing ingredients into batter
pptYu3YQnxY_160_170.avi,lady is making the oats meals cookie
pptYu3YQnxY_160_170.avi,lady making oatmeal cookies
pptYu3YQnxY_160_170.avi,lady preparing for the cake
pptYu3YQnxY_160_170.avi,man is demonstrating how to cook the oats cookies
pptYu3YQnxY_160_170.avi,person is mixing cookie ingredients in bowl
pptYu3YQnxY_160_170.avi,person making oatmeal cookies
pptYu3YQnxY_160_170.avi,person showing how to make cake
pptYu3YQnxY_160_170.avi,woman mixing batter
pptYu3YQnxY_160_170.avi,someone is mixing someting in bowl
pptYu3YQnxY_160_170.avi,person is mixing batter in bowl by hand
pptYu3YQnxY_160_170.avi,person is mixing ingredients together in bowl
pptYu3YQnxY_160_170.avi,woman is stirring cookie ingredients in bowl
pptYu3YQnxY_160_170.avi,woman is stirring cookie ingredients
pptYu3YQnxY_160_170.avi,woman learning how to make oatmeal cookies
pptYu3YQnxY_160_170.avi,woman mixes ingredients to cook cookies
pptYu3YQnxY_160_170.avi,woman showing how to make oatmeal cookies
pptYu3YQnxY_160_170.avi,dough is prepared for making cookies
pptYu3YQnxY_160_170.avi,how to make oatmeal cookies
pptYu3YQnxY_160_170.avi,nancy preparing to cook oatmeal cookies
pptYu3YQnxY_160_170.avi,somebody is mixing some food stuff
pptYu3YQnxY_160_170.avi,someone is mixing something in bowl
pptYu3YQnxY_160_170.avi,the woman is mixing cookie dough
pptYu3YQnxY_160_170.avi,woman batter some ingredients in bowl
yg4aNiO1JnI_111_114.avi,dog is bouncing his front paws on trampoline
yg4aNiO1JnI_111_114.avi,dog is on trampoline
yg4aNiO1JnI_111_114.avi,dog is jumping on trampoline
yg4aNiO1JnI_111_114.avi,dog is jumping on jumper
yg4aNiO1JnI_111_114.avi,dog is playing on trampoline
yg4aNiO1JnI_111_114.avi,dog is bouncing on trampoline
yg4aNiO1JnI_111_114.avi,dog is jumping over trampoline
yg4aNiO1JnI_111_114.avi,dog is pouncing on trampoline
yg4aNiO1JnI_111_114.avi,dogs is playing on trampoline
yg4aNiO1JnI_111_114.avi,the dog played on the trampoline
yg4aNiO1JnI_111_114.avi,the dog is jumping on the trampoline
yg4aNiO1JnI_111_114.avi,dog bounces on trampoline
yg4aNiO1JnI_111_114.avi,dog playing on trampoline
yg4aNiO1JnI_111_114.avi,the dog is jumping
yg4aNiO1JnI_111_114.avi,the dog bounced on the trampoline in fun
yg4aNiO1JnI_111_114.avi,thd dog is jumping on the trampoline
kJY5BRCNAs4_3_6.avi,baby picks up phone
kJY5BRCNAs4_3_6.avi,baby girl is hanging up phone
kJY5BRCNAs4_3_6.avi,baby girl places the receiver of the phone back on the base
kJY5BRCNAs4_3_6.avi,baby hangs up phone
kJY5BRCNAs4_3_6.avi,baby is hanging up phone
kJY5BRCNAs4_3_6.avi,baby is speaking on telephone
kJY5BRCNAs4_3_6.avi,baby is talking on phone
kJY5BRCNAs4_3_6.avi,baby picks up telephone and is holding it in her hand
kJY5BRCNAs4_3_6.avi,baby talks on the phone
kJY5BRCNAs4_3_6.avi,little girl hangs up phone
kJY5BRCNAs4_3_6.avi,little girl is hanging up phone
kJY5BRCNAs4_3_6.avi,toddler puts down the telephone
kJY5BRCNAs4_3_6.avi,young girl is hanging up the phone
kJY5BRCNAs4_3_6.avi,after talking on the phone baby hangs up
kJY5BRCNAs4_3_6.avi,the baby is talking on the phone
kJY5BRCNAs4_3_6.avi,the little girl hung up the telephone
kJY5BRCNAs4_3_6.avi,baby is making phone call
kJY5BRCNAs4_3_6.avi,baby is playing with the telephone
kJY5BRCNAs4_3_6.avi,baby is talking on phone
kJY5BRCNAs4_3_6.avi,child is playing with phone
kJY5BRCNAs4_3_6.avi,cute baby talking on phone
kJY5BRCNAs4_3_6.avi,little baby pretending to be talking to someone on the phone
kJY5BRCNAs4_3_6.avi,little baby talking on phone
kJY5BRCNAs4_3_6.avi,small boy gaming on the phone
kJY5BRCNAs4_3_6.avi,baby hangs up telephone
kJY5BRCNAs4_3_6.avi,baby holding phone
kJY5BRCNAs4_3_6.avi,baby is hanging up telephone
kJY5BRCNAs4_3_6.avi,baby is talking on phone
kJY5BRCNAs4_3_6.avi,baby puts down phone receiver
kJY5BRCNAs4_3_6.avi,baby speeking in the telephone
kJY5BRCNAs4_3_6.avi,baby talking on phone
kJY5BRCNAs4_3_6.avi,child is playing with telephone
kJY5BRCNAs4_3_6.avi,little baby talking with phone
kJY5BRCNAs4_3_6.avi,small kid talking in phone
kJY5BRCNAs4_3_6.avi,funny baby talks phone video very interesting
kJY5BRCNAs4_3_6.avi,the baby playing with phone
kJY5BRCNAs4_3_6.avi,kid is playing with the telephone
kJY5BRCNAs4_3_6.avi,baby playing with phone
kJY5BRCNAs4_3_6.avi,baby talking on phone
2I20ZTFHheg_96_104.avi,person cuts sock
2I20ZTFHheg_96_104.avi,person is cutting sock with scissor
2I20ZTFHheg_96_104.avi,person cuts sock with scissors
2I20ZTFHheg_96_104.avi,man is cutting off the top portion of sock
2I20ZTFHheg_96_104.avi,person is cutting cloth
2I20ZTFHheg_96_104.avi,person is cutting sock with scissors
2I20ZTFHheg_96_104.avi,man cuts sock in two with pair of scissors
2I20ZTFHheg_96_104.avi,person is cutting cloth with shears
2I20ZTFHheg_96_104.avi,person cuts piece of fabric with scissors
2I20ZTFHheg_96_104.avi,someone is cutting the top off sock
2I20ZTFHheg_96_104.avi,guy is cutting sock
2I20ZTFHheg_96_104.avi,someone cut the top off sock
2I20ZTFHheg_96_104.avi,the person is cutting socks
2I20ZTFHheg_96_104.avi,person cuts up knit sock
2I20ZTFHheg_96_104.avi,somone cut sock
2I20ZTFHheg_96_104.avi,person is cutting sock
2I20ZTFHheg_96_104.avi,person is cutting the cloth
2I20ZTFHheg_96_104.avi,man is cutting sock
2I20ZTFHheg_96_104.avi,the person cut the cloth with the help of the sisser
2I20ZTFHheg_96_104.avi,man is cutting the wool cloth
2I20ZTFHheg_96_104.avi,someone is vutting up sock
2I20ZTFHheg_96_104.avi,someone is cutting his or her sock
2I20ZTFHheg_96_104.avi,someone cuts sock with some scissors
2I20ZTFHheg_96_104.avi,someone is cutting sock
2I20ZTFHheg_96_104.avi,man cutting socks
2I20ZTFHheg_96_104.avi,person is cutting the shocks
2I20ZTFHheg_96_104.avi,man is cutting piece of wool with scissors
2I20ZTFHheg_96_104.avi,any one cut the cloth
2I20ZTFHheg_96_104.avi,gingher dressmakers shears video
Ylb4pnW-jP4_102_113.avi,young man running down the stairs
Ylb4pnW-jP4_102_113.avi,barefoot man is running down stairs
Ylb4pnW-jP4_102_113.avi,man is hurriedly running down staircase
Ylb4pnW-jP4_102_113.avi,man is running down flight of stairs
Ylb4pnW-jP4_102_113.avi,man is running down several flights of stairs
Ylb4pnW-jP4_102_113.avi,man is running down stairs
Ylb4pnW-jP4_102_113.avi,man is running down the stairs
Ylb4pnW-jP4_102_113.avi,man is walking downstairs
Ylb4pnW-jP4_102_113.avi,man runs down several flights of stairs
Ylb4pnW-jP4_102_113.avi,man runs down stairs
Ylb4pnW-jP4_102_113.avi,man runs frantically down flight of stairs
Ylb4pnW-jP4_102_113.avi,the boy ran down the stairs
Ylb4pnW-jP4_102_113.avi,the man ran down the stairs
Ylb4pnW-jP4_102_113.avi,boy is coming down stairs very fast
Ylb4pnW-jP4_102_113.avi,guy is admit in the hospital
Ylb4pnW-jP4_102_113.avi,man is running franticaly down the stairs
Ylb4pnW-jP4_102_113.avi,man taking down steps in panic
Ylb4pnW-jP4_102_113.avi,men runing their
Ylb4pnW-jP4_102_113.avi,one man is coming from stairs very speedly
Ylb4pnW-jP4_102_113.avi,one man coming down from stairs very speedly
Ylb4pnW-jP4_102_113.avi,the devil is in the room
Ylb4pnW-jP4_102_113.avi,man hurriedly runs downstairs
Ylb4pnW-jP4_102_113.avi,man is get down fastly from the steps
Ylb4pnW-jP4_102_113.avi,man is getting down
Ylb4pnW-jP4_102_113.avi,man is looking surprised
Ylb4pnW-jP4_102_113.avi,man is lying on the bed
Ylb4pnW-jP4_102_113.avi,man running down some stairs
Ylb4pnW-jP4_102_113.avi,man running down the stairs
Ylb4pnW-jP4_102_113.avi,man stair down hastly
Ylb4pnW-jP4_102_113.avi,person is running down stairs
Ylb4pnW-jP4_102_113.avi,couple are lying on bed
Ylb4pnW-jP4_102_113.avi,patient is running
Ylb4pnW-jP4_102_113.avi,the man is steps down
Ylb4pnW-jP4_102_113.avi,man is escaping
n_Z0-giaspE_379_387.avi,boy falls down and two other boys with surprised looks assist him up
n_Z0-giaspE_379_387.avi,boy falls to the ground and his friends help him up
n_Z0-giaspE_379_387.avi,boy fell to the ground
n_Z0-giaspE_379_387.avi,boy who has fallen is helped up by two other boys
n_Z0-giaspE_379_387.avi,kid falls down
n_Z0-giaspE_379_387.avi,man falls down and two men help him up
n_Z0-giaspE_379_387.avi,young man falls down and is helped up by two other guys
n_Z0-giaspE_379_387.avi,young man falls on the ground and his two friends standing nearby help him get up
n_Z0-giaspE_379_387.avi,young man takes slow exaggerated fall and two other young men help him get up
n_Z0-giaspE_379_387.avi,the man fell down on the ground
n_Z0-giaspE_379_387.avi,three men are acting
n_Z0-giaspE_379_387.avi,two boys help another boy that has fallen down
n_Z0-giaspE_379_387.avi,two boys helped up friend who had fallen down
n_Z0-giaspE_379_387.avi,two men are helping up another man who has fallen on the ground
n_Z0-giaspE_379_387.avi,the person is running the camp
n_Z0-giaspE_379_387.avi,two men help man who as fallen get up
n_Z0-giaspE_379_387.avi,boy falls and two others run to help him up
n_Z0-giaspE_379_387.avi,two guys help boy up off the ground
n_Z0-giaspE_379_387.avi,boy falls to the ground
n_Z0-giaspE_379_387.avi,the men are picking up the fallen person
n_Z0-giaspE_379_387.avi,man fells down
n_Z0-giaspE_379_387.avi,young man is falling down and his friends are running to help him up
n_Z0-giaspE_379_387.avi,boy falls down
n_Z0-giaspE_379_387.avi,man falls and other men pick him up
n_Z0-giaspE_379_387.avi,three mne are walking
n_Z0-giaspE_379_387.avi,man falls and is helped up
n_Z0-giaspE_379_387.avi,two young men put together video about church package
n_Z0-giaspE_379_387.avi,man falls over in the road
n_Z0-giaspE_379_387.avi,someone falls down
n_Z0-giaspE_379_387.avi,two guys helping another guy
n_Z0-giaspE_379_387.avi,guy is falling
n_Z0-giaspE_379_387.avi,man is falling down and the other two men are giving him hands to get up
n_Z0-giaspE_379_387.avi,boy is slipping on the floor
n_Z0-giaspE_379_387.avi,two friends beating boy by laying him on the ground
n_Z0-giaspE_379_387.avi,boy has feel down
n_Z0-giaspE_379_387.avi,boy is falling
n_Z0-giaspE_379_387.avi,men is fell down in land
n_Z0-giaspE_379_387.avi,group of boys are acting like theyre in slow motion
n_Z0-giaspE_379_387.avi,church camp
n_Z0-giaspE_379_387.avi,boy is falling down
mYzajpeAWuA_100_112.avi,amanplaysaguitar
mYzajpeAWuA_100_112.avi,man is passionately playing guitar in front of an audience
mYzajpeAWuA_100_112.avi,man is paying guitar on stage
mYzajpeAWuA_100_112.avi,the man enjoyed playing his guitar
mYzajpeAWuA_100_112.avi,the person playing the music
mYzajpeAWuA_100_112.avi,the man is playing guiter
mYzajpeAWuA_100_112.avi,man is playing guitar in the stage
mYzajpeAWuA_100_112.avi,boy is playin some instrument
mYzajpeAWuA_100_112.avi,man is enjoying himself while strumming the guitar
mYzajpeAWuA_100_112.avi,tommy emmanuel playing day tripper in music video
mYzajpeAWuA_100_112.avi,musician playing guitar in concert
mYzajpeAWuA_100_112.avi,man playing guitar on the stage performance
mYzajpeAWuA_100_112.avi,men playing gitter
mYzajpeAWuA_100_112.avi,man plays acoustic guitar for an audience
mYzajpeAWuA_100_112.avi,man is playing acoustic guitar on stage
PECk9A-07Pw_1_9.avi,man playing the accordion
PECk9A-07Pw_1_9.avi,man is playing keyboard instrument
PECk9A-07Pw_1_9.avi,man is playing keyboards
PECk9A-07Pw_1_9.avi,man is playing two keyboards
PECk9A-07Pw_1_9.avi,man is playing two pianos
PECk9A-07Pw_1_9.avi,man played the organ
PECk9A-07Pw_1_9.avi,man plays an electronic organ
PECk9A-07Pw_1_9.avi,man plays two keyboards
PECk9A-07Pw_1_9.avi,person is playing double keyboards
PECk9A-07Pw_1_9.avi,an individual plays keyboard
PECk9A-07Pw_1_9.avi,someone is playing organ
PECk9A-07Pw_1_9.avi,the man played an organ
PECk9A-07Pw_1_9.avi,someone is playing on keyboard
PECk9A-07Pw_1_9.avi,man playing the pianokeyboard
PECk9A-07Pw_1_9.avi,the music group playing with their instruments
PECk9A-07Pw_1_9.avi,man is playing piano
PECk9A-07Pw_1_9.avi,group of men playing violin
PECk9A-07Pw_1_9.avi,people were playing violin
PECk9A-07Pw_1_9.avi,man is playig keyboard
PECk9A-07Pw_1_9.avi,man is playing piano keyboard
PECk9A-07Pw_1_9.avi,someone is playing two keyboards
PECk9A-07Pw_1_9.avi,music video of the doors band
PECk9A-07Pw_1_9.avi,musician playing on piano
PECk9A-07Pw_1_9.avi,man pressing two piano keyboards at time
PECk9A-07Pw_1_9.avi,someone is playing the organ
PECk9A-07Pw_1_9.avi,man playing different piano with both hands
PECk9A-07Pw_1_9.avi,man is playing on two keyboards
PECk9A-07Pw_1_9.avi,man is playing an electric keyboard onstage
PECk9A-07Pw_1_9.avi,man plays keyboard instrument
e-j59PqJjSM_405_416.avi,someone is stirring salad mixture in large metal bowl
e-j59PqJjSM_405_416.avi,man is mixing bowl
e-j59PqJjSM_405_416.avi,person is mixing bowl of food
e-j59PqJjSM_405_416.avi,someone is using spatula to stir the contents of metal bowl
e-j59PqJjSM_405_416.avi,person is mixing food together in large metal bowl
e-j59PqJjSM_405_416.avi,man is stirring something in bowl
e-j59PqJjSM_405_416.avi,person is mixing food in bowl
e-j59PqJjSM_405_416.avi,person stirs bowl full of food
e-j59PqJjSM_405_416.avi,man is stirring bowl of food
e-j59PqJjSM_405_416.avi,person is mixing salad
e-j59PqJjSM_405_416.avi,man stirs all the ingredients of greek salad placed in large bowl with flat steel spoon to mix them well
e-j59PqJjSM_405_416.avi,the cook is stirring the vegetables
e-j59PqJjSM_405_416.avi,man is mixing ingredients in large mixing bowl
e-j59PqJjSM_405_416.avi,someone is mixing salad in bowl
e-j59PqJjSM_405_416.avi,the man stirred the vegetables in the big bowl
e-j59PqJjSM_405_416.avi,man is mixing ingredients in large bowl
e-j59PqJjSM_405_416.avi,person is making salad
e-j59PqJjSM_405_416.avi,the person is preparing the food
e-j59PqJjSM_405_416.avi,someone is stirring things in bowl
e-j59PqJjSM_405_416.avi,boy is mixing something
e-j59PqJjSM_405_416.avi,chef shows the ingredients and how to prepare greek salad
e-j59PqJjSM_405_416.avi,the man stirred the ingredients in big bowl
e-j59PqJjSM_405_416.avi,the man is stirring the vegetables
e-j59PqJjSM_405_416.avi,woman is mixing salad in bowl
