VideoID,Decription
jCplbayVbtw_10_20.avi,the tortoise is walking
jCplbayVbtw_10_20.avi,tortoise walks along slowly
jCplbayVbtw_10_20.avi,the land turtle moved along the ground
jCplbayVbtw_10_20.avi,giant turtle is walking around
jCplbayVbtw_10_20.avi,one tortoise is walking
jCplbayVbtw_10_20.avi,tortoise is waking on the ground
jCplbayVbtw_10_20.avi,tortoise is walking
jCplbayVbtw_10_20.avi,tortoise lumbers down path
jCplbayVbtw_10_20.avi,mathilda the friendly giant tortoise video
jCplbayVbtw_10_20.avi,the tortoise is moving
jCplbayVbtw_10_20.avi,the tortoise walked by
jCplbayVbtw_10_20.avi,tortoise is searching something
gp8XjWSoP2k_0_10.avi,baby animal playing persons hand
gp8XjWSoP2k_0_10.avi,baby skunk is being held up for the camera
gp8XjWSoP2k_0_10.avi,boy is holding baby skunk
gp8XjWSoP2k_0_10.avi,man holds small skunk
gp8XjWSoP2k_0_10.avi,man is holding skunk in his hand
gp8XjWSoP2k_0_10.avi,man is holding skunk in his left hand
gp8XjWSoP2k_0_10.avi,person is holding skunk
gp8XjWSoP2k_0_10.avi,person is holding young skunk
gp8XjWSoP2k_0_10.avi,person is showing off baby skunk
gp8XjWSoP2k_0_10.avi,skunk is looking here and there
gp8XjWSoP2k_0_10.avi,skunk looks at the camera
gp8XjWSoP2k_0_10.avi,someone held baby skunk
gp8XjWSoP2k_0_10.avi,someone is holding skunk
gp8XjWSoP2k_0_10.avi,the man is holding skunk
gp8XjWSoP2k_0_10.avi,person is catching the rat in his hand
gp8XjWSoP2k_0_10.avi,black pet is shown
gp8XjWSoP2k_0_10.avi,man is holding skunk
gp8XjWSoP2k_0_10.avi,man is holding pet animal
gp8XjWSoP2k_0_10.avi,person is holding animal
gp8XjWSoP2k_0_10.avi,person with baby skunk
gp8XjWSoP2k_0_10.avi,skunk is eating food
gp8XjWSoP2k_0_10.avi,new stunk was carried by man
gp8XjWSoP2k_0_10.avi,person is holding baby skunk
gp8XjWSoP2k_0_10.avi,some animals are sitting in boss hand
gp8XjWSoP2k_0_10.avi,skunk is sitting in someones hand
gp8XjWSoP2k_0_10.avi,it is small skunk
gp8XjWSoP2k_0_10.avi,man is holding his new skunk in his hand
gp8XjWSoP2k_0_10.avi,someone holding baby skunk
gp8XjWSoP2k_0_10.avi,someone holds skunk
gp8XjWSoP2k_0_10.avi,man is showing off his new pet skunk
gp8XjWSoP2k_0_10.avi,woman carrying skunk
gp8XjWSoP2k_0_10.avi,an animal is being held
gp8XjWSoP2k_0_10.avi,some animal is lying on its masters hand
gp8XjWSoP2k_0_10.avi,amn is holding his new skunk
gp8XjWSoP2k_0_10.avi,man holding skunk in his hands and playing with it
gp8XjWSoP2k_0_10.avi,man hold the little skunk in his hand
gp8XjWSoP2k_0_10.avi,boy with skunk
gp8XjWSoP2k_0_10.avi,baby of skunk
gp8XjWSoP2k_0_10.avi,men with skunk
gp8XjWSoP2k_0_10.avi,someone is holding baby skunk
gp8XjWSoP2k_0_10.avi,man is holding skunk in one hand
gp8XjWSoP2k_0_10.avi,the person is holding skunk
gp8XjWSoP2k_0_10.avi,man is holding new skunk
gp8XjWSoP2k_0_10.avi,baby skunk is being held in someones hand
gp8XjWSoP2k_0_10.avi,someone holds baby skunk in one hand
BOLKaQeB6j0_101_111.avi,lady is peeling the skin of boiled potato
BOLKaQeB6j0_101_111.avi,lady pealing potato
BOLKaQeB6j0_101_111.avi,woman is peeling baked potato
BOLKaQeB6j0_101_111.avi,woman is peeling potato over kitchen sink
BOLKaQeB6j0_101_111.avi,woman is peeling the skin of boiled potato
BOLKaQeB6j0_101_111.avi,woman peels potato with her fingers
BOLKaQeB6j0_101_111.avi,woman stands over the sink and peels potato
BOLKaQeB6j0_101_111.avi,one woman is removing potatos skin
BOLKaQeB6j0_101_111.avi,the lady is peeling potatoes in the sink
BOLKaQeB6j0_101_111.avi,lady is getting off the cover of potato
BOLKaQeB6j0_101_111.avi,lady removing the skin of potato
BOLKaQeB6j0_101_111.avi,woman is pulling the skin from potato
BOLKaQeB6j0_101_111.avi,angela lady in her kitchen showing how to make potato curry with yogurt gravy
BOLKaQeB6j0_101_111.avi,she cooks potato along with deep love
BOLKaQeB6j0_101_111.avi,lady is peeling the skin of potatoe
BOLKaQeB6j0_101_111.avi,woman is doing kitchen work
BOLKaQeB6j0_101_111.avi,woman is making potato curry
BOLKaQeB6j0_101_111.avi,woman is peeling boiled potato with her hands
BOLKaQeB6j0_101_111.avi,woman is peeling cooked potato
BOLKaQeB6j0_101_111.avi,woman is peeling cooked potato by hand
BOLKaQeB6j0_101_111.avi,woman is peeling cooked potato
BOLKaQeB6j0_101_111.avi,woman is peeling potato with her fingers
BOLKaQeB6j0_101_111.avi,woman is peeling potatoes
BOLKaQeB6j0_101_111.avi,woman is peeling the skin off of potato
BOLKaQeB6j0_101_111.avi,women is cooking in the kitchen
BOLKaQeB6j0_101_111.avi,preparing potato curry on cooking range
BOLKaQeB6j0_101_111.avi,the lady is peeling the skin off the potato
BOLKaQeB6j0_101_111.avi,the lady peeled cooked potatoe
BOLKaQeB6j0_101_111.avi,the lady peeled potatoes
BOLKaQeB6j0_101_111.avi,woman peels boiled potato by hand
1N_Ic2pBM1o_2_23.avi,woman is playing guitar and singing
1N_Ic2pBM1o_2_23.avi,girl is playing an acoustic guitar and singing
1N_Ic2pBM1o_2_23.avi,girl is playing guitar and singing
1N_Ic2pBM1o_2_23.avi,woman is singing and playing guitar
1N_Ic2pBM1o_2_23.avi,woman is singing and playing guitar
1N_Ic2pBM1o_2_23.avi,woman is singing while playing the guitar
1N_Ic2pBM1o_2_23.avi,young woman is singing and playing the guitar
1N_Ic2pBM1o_2_23.avi,young woman sings and plays the guitar
1N_Ic2pBM1o_2_23.avi,woman seated is singing song and playing the guitar too
1N_Ic2pBM1o_2_23.avi,the woman is singing and playing the guitar
1N_Ic2pBM1o_2_23.avi,the girl played the guitar on the floor
1N_Ic2pBM1o_2_23.avi,girl playing guitar
1N_Ic2pBM1o_2_23.avi,young woman is playing guitar and singing
1N_Ic2pBM1o_2_23.avi,woman is singing song
1N_Ic2pBM1o_2_23.avi,woman is singing with the guitar
1N_Ic2pBM1o_2_23.avi,lady plays guitar and she sing song
1N_Ic2pBM1o_2_23.avi,girl playing guitar in angry manner
1N_Ic2pBM1o_2_23.avi,girl playing guitar
1N_Ic2pBM1o_2_23.avi,girl is playing the guitar
1N_Ic2pBM1o_2_23.avi,woman is playing an acoustic guitar and singing
1N_Ic2pBM1o_2_23.avi,woman is playing guitar and singing
1N_Ic2pBM1o_2_23.avi,lovely music and song
1N_Ic2pBM1o_2_23.avi,girl is singing and playing guitar
1N_Ic2pBM1o_2_23.avi,girl is playing acoustic guitar and singing
1N_Ic2pBM1o_2_23.avi,the girl is playing the music
1N_Ic2pBM1o_2_23.avi,young girl playing guitar
1N_Ic2pBM1o_2_23.avi,girl plays cover of song on guitar
kuNQpRTc-hA_126_135.avi,baby mother lovable relation
kuNQpRTc-hA_126_135.avi,toddler gets shot at the doctors office
kuNQpRTc-hA_126_135.avi,baby receiving vaccine
kuNQpRTc-hA_126_135.avi,doctor was doing injection to baby and that baby was crying
kuNQpRTc-hA_126_135.avi,putting injection for baby
kuNQpRTc-hA_126_135.avi,the baby received shot in the arm
kuNQpRTc-hA_126_135.avi,the doctor inject the baby
kuNQpRTc-hA_126_135.avi,baby gets shot and cries
kuNQpRTc-hA_126_135.avi,baby gets shot in the arm and cries
kuNQpRTc-hA_126_135.avi,baby gets shot
kuNQpRTc-hA_126_135.avi,baby is being injected in the arm
kuNQpRTc-hA_126_135.avi,baby is crying when getting shot in her arm
kuNQpRTc-hA_126_135.avi,baby is getting shot
kuNQpRTc-hA_126_135.avi,baby is getting an injection in his shoulders
kuNQpRTc-hA_126_135.avi,baby is getting an injection
kuNQpRTc-hA_126_135.avi,baby is receiving flu shot
kuNQpRTc-hA_126_135.avi,baby receives vaccination
kuNQpRTc-hA_126_135.avi,child gets shot and cries
kuNQpRTc-hA_126_135.avi,child is being administered with subcutaneous injection on the right deltoid muscle
kuNQpRTc-hA_126_135.avi,child is being given vaccination
kuNQpRTc-hA_126_135.avi,child is being injected
kuNQpRTc-hA_126_135.avi,child is getting an injection
kuNQpRTc-hA_126_135.avi,doctor gives shot to baby
kuNQpRTc-hA_126_135.avi,doctor gives shot to crying baby
kuNQpRTc-hA_126_135.avi,doctor giving injection to baby
kuNQpRTc-hA_126_135.avi,doctor is injecting needle into young childs arm
kuNQpRTc-hA_126_135.avi,doctor is injecting to baby
kuNQpRTc-hA_126_135.avi,doctor is putting injection to baby
kuNQpRTc-hA_126_135.avi,doctor put an injection to child
kuNQpRTc-hA_126_135.avi,nurse holds the right arm of small baby and doctor injects vaccine with syringe after wiping the area with cotton
kuNQpRTc-hA_126_135.avi,young child is being given shot with hypodermic needle
kuNQpRTc-hA_126_135.avi,an asian baby is getting an injection shot on his arm
kuNQpRTc-hA_126_135.avi,an injection is given to kid
kuNQpRTc-hA_126_135.avi,baby is receiving vaccination
kuNQpRTc-hA_126_135.avi,in video injection is given to baby and he is crying
kuNQpRTc-hA_126_135.avi,little girl receiving shot
kuNQpRTc-hA_126_135.avi,small child get an vaccination
kuNQpRTc-hA_126_135.avi,the doctor is injecting the baby so it is crying
kuNQpRTc-hA_126_135.avi,the doctor is injecting the child
EVqc7e8JCco_5_15.avi,the zebras are playing
EVqc7e8JCco_5_15.avi,two zebras are running and playing with each other in the grass
EVqc7e8JCco_5_15.avi,two zebras are fighting
EVqc7e8JCco_5_15.avi,two zebras playing with each other
EVqc7e8JCco_5_15.avi,pair of zebras interact on the savannah
EVqc7e8JCco_5_15.avi,two zebra are playing
EVqc7e8JCco_5_15.avi,two zebras are playing
EVqc7e8JCco_5_15.avi,two zebras are playing in field
EVqc7e8JCco_5_15.avi,zebras are playing
EVqc7e8JCco_5_15.avi,two zebras fight with each other
EVqc7e8JCco_5_15.avi,zebras are socializing
EVqc7e8JCco_5_15.avi,two zebras play in an open field
EVqc7e8JCco_5_15.avi,two zebras are playing around with each other on grassland
EVqc7e8JCco_5_15.avi,two zebras playfully nuzzled each other
EVqc7e8JCco_5_15.avi,the two zebras are playing
EVqc7e8JCco_5_15.avi,two zebras play with each other
EVqc7e8JCco_5_15.avi,the zebras playfully nudged each other
EVqc7e8JCco_5_15.avi,two zebra are fighting
EVqc7e8JCco_5_15.avi,two zebra are playing
EVqc7e8JCco_5_15.avi,the zebras are playing
EVqc7e8JCco_5_15.avi,two zebras are fighting each other
EVqc7e8JCco_5_15.avi,zebras crossing stretch of water
EVqc7e8JCco_5_15.avi,two zebras are fightingplaying with each other
EVqc7e8JCco_5_15.avi,friendship is very sweet in this world
EVqc7e8JCco_5_15.avi,zebra vs zebra
EVqc7e8JCco_5_15.avi,couple of zebra grazing in field
EVqc7e8JCco_5_15.avi,simply super zebras
EVqc7e8JCco_5_15.avi,the zebras are pushing each other
EVqc7e8JCco_5_15.avi,two zebras are trying for crossing
ybVb3t560oY_0_9.avi,chickens are attacking rabbits
ybVb3t560oY_0_9.avi,chickens intervene in high speed bunny chase
ybVb3t560oY_0_9.avi,one rabbit chases another and then two chickens arrive and get in between them
ybVb3t560oY_0_9.avi,rabbits and chickens are fighting
ybVb3t560oY_0_9.avi,rabbits and hens are fighting
ybVb3t560oY_0_9.avi,the chickens are fighting the rabbits
ybVb3t560oY_0_9.avi,the rabbits and chickens fought together in the yard
ybVb3t560oY_0_9.avi,the rabbits and chickens fought together
ybVb3t560oY_0_9.avi,two chickens attack two rabbits
ybVb3t560oY_0_9.avi,two chickens stop two rabbits fighting
ybVb3t560oY_0_9.avi,two rabbits and chickens are playing
ybVb3t560oY_0_9.avi,two rabbits and two chickens are playing
ybVb3t560oY_0_9.avi,two rabbits and two roosters get into scuffle
ybVb3t560oY_0_9.avi,two rabbits are chasing each other when they are attacked by two chickens
ybVb3t560oY_0_9.avi,two rabbits are fighting with each other as two hens intervene and stop them
ybVb3t560oY_0_9.avi,two rabbits are fighting
ybVb3t560oY_0_9.avi,two rabbits are frolicking together when they are attacked by pair of chickens
ybVb3t560oY_0_9.avi,white rabbit trying to catch black rabbit
ybVb3t560oY_0_9.avi,the rabbits and hens are fighting
ybVb3t560oY_0_9.avi,two chickens stop rabbits from fighting
ybVb3t560oY_0_9.avi,the animals are fighting
ybVb3t560oY_0_9.avi,chicken attacks bunny
ybVb3t560oY_0_9.avi,two rabbits were fighting when they saw hens the rabbits kept calm
ybVb3t560oY_0_9.avi,two chickens stop fight between two rabbits
ybVb3t560oY_0_9.avi,two animals chasing each other
ybVb3t560oY_0_9.avi,two chickens are stopping rabbit fight
ybVb3t560oY_0_9.avi,hens and rabbits are fighting
ybVb3t560oY_0_9.avi,two rabbits running and hen fighting with them
ybVb3t560oY_0_9.avi,the animals are fighting
ybVb3t560oY_0_9.avi,two hens trying to catch out the rabbits playing in lawn
ybVb3t560oY_0_9.avi,two rabbits are fighting
ybVb3t560oY_0_9.avi,animals are playing
ybVb3t560oY_0_9.avi,some animals are caughting each other
ybVb3t560oY_0_9.avi,two rabbits are playing
ybVb3t560oY_0_9.avi,chicken playing
ybVb3t560oY_0_9.avi,very cleaver chicken police
ybVb3t560oY_0_9.avi,the rabbits are running and jumping
ybVb3t560oY_0_9.avi,hey we said stop fighting you both
Je3V7U5Ctj4_634_639.avi,someone folds flour tortilla with cheese in half in metal pan using their fingers and spatula
Je3V7U5Ctj4_634_639.avi,person folds tortilla
Je3V7U5Ctj4_634_639.avi,man folds tortilla
Je3V7U5Ctj4_634_639.avi,man folds cheesy tortilla
Je3V7U5Ctj4_634_639.avi,man is cooking quesadilla in frying pan
Je3V7U5Ctj4_634_639.avi,man is cooking tortilla in skillet
Je3V7U5Ctj4_634_639.avi,man is making quesadilla in frying pan
Je3V7U5Ctj4_634_639.avi,person is folding tortilla in half
Je3V7U5Ctj4_634_639.avi,man folds tortilla over in pan
Je3V7U5Ctj4_634_639.avi,man is folding something in skillet
Je3V7U5Ctj4_634_639.avi,man is frying tortilla
Je3V7U5Ctj4_634_639.avi,someone is flipping tortila
Je3V7U5Ctj4_634_639.avi,man is folding over tortilla in pan
Je3V7U5Ctj4_634_639.avi,the man turned the quesadilla in half in the pan
Je3V7U5Ctj4_634_639.avi,the man is cooking crepe
Je3V7U5Ctj4_634_639.avi,person folds over soft taco
Je3V7U5Ctj4_634_639.avi,the man folded the quesadilla over in the pan
Je3V7U5Ctj4_634_639.avi,man in red tshirt about to prepare something in the kitchen
Je3V7U5Ctj4_634_639.avi,man is folding pita in pan
Je3V7U5Ctj4_634_639.avi,some one is make the stuffed chapathi
Je3V7U5Ctj4_634_639.avi,person folds tortilla with cheese
Je3V7U5Ctj4_634_639.avi,man is cooking pizza
Je3V7U5Ctj4_634_639.avi,man folds tortilla in half
Je3V7U5Ctj4_634_639.avi,man frys and folds cheese quesadilla
Je3V7U5Ctj4_634_639.avi,man coking chapathi
Je3V7U5Ctj4_634_639.avi,he is making dosha
Je3V7U5Ctj4_634_639.avi,person make finger food
Je3V7U5Ctj4_634_639.avi,dish is very taste food
Je3V7U5Ctj4_634_639.avi,the man is making quesedillas
Je3V7U5Ctj4_634_639.avi,man is folding over cheese filled tortilla
Je3V7U5Ctj4_634_639.avi,someone is flipping tortilla filled with cheese and onions with spatula and then pressing down on it
Je3V7U5Ctj4_634_639.avi,super football finger food video
K1ZM0LSLVw8_481_487.avi,man is scooping the seeds out of what appears to be half of peeled cucumber
K1ZM0LSLVw8_481_487.avi,man scoops out seeds from cucumber
K1ZM0LSLVw8_481_487.avi,man slices peeled cucumber in half and then he scoops out the center of the cucumber half
K1ZM0LSLVw8_481_487.avi,man is cutting cucumber into two pieces
K1ZM0LSLVw8_481_487.avi,chef slices and pits cucumber
K1ZM0LSLVw8_481_487.avi,man is scraping the seeds from cucumbers with spoon
K1ZM0LSLVw8_481_487.avi,person with knife is slicing vegetable
K1ZM0LSLVw8_481_487.avi,person scoops out the innards of pickle
K1ZM0LSLVw8_481_487.avi,someone is getting the seads out of vegtable
K1ZM0LSLVw8_481_487.avi,man is coring cucumber
K1ZM0LSLVw8_481_487.avi,man scrapes out the seeds from one elongated half of peeled cucumber using spoon
K1ZM0LSLVw8_481_487.avi,the man sliced the pickle
K1ZM0LSLVw8_481_487.avi,the man is removing seeds from the squash
K1ZM0LSLVw8_481_487.avi,food is scraped out
K1ZM0LSLVw8_481_487.avi,the man cut type of squash
K1ZM0LSLVw8_481_487.avi,man is removing cucumber seeds
K1ZM0LSLVw8_481_487.avi,the person show how to cut the cucumber and make the san dwich
K1ZM0LSLVw8_481_487.avi,man is scraping the vegetable using spoon
K1ZM0LSLVw8_481_487.avi,the person is removing seeds from cucumber
K1ZM0LSLVw8_481_487.avi,man is scraping seeds with spoon
K1ZM0LSLVw8_481_487.avi,man cutting cucumber
K1ZM0LSLVw8_481_487.avi,man is pealing and cutting vegetable which looks like cucamber for preparing sandwich
K1ZM0LSLVw8_481_487.avi,he is cutting vegetable
K1ZM0LSLVw8_481_487.avi,this man clean cucumber seeds
K1ZM0LSLVw8_481_487.avi,person making big fat greek sandwich
K1ZM0LSLVw8_481_487.avi,man is making the sandwich
K1ZM0LSLVw8_481_487.avi,the man is remvoing the seeds from the cucumber
K1ZM0LSLVw8_481_487.avi,man prepares cucumber for cooking
K1ZM0LSLVw8_481_487.avi,anyone is slicing
K1ZM0LSLVw8_481_487.avi,man is taking the seeds out of cucumber
K1ZM0LSLVw8_481_487.avi,very colourful sandwitch
K1ZM0LSLVw8_481_487.avi,man is scraping out cucumber seeds
K1ZM0LSLVw8_481_487.avi,someone scrapes the seeds from cucumber
s20OlIRK340_125_138.avi,someone is peeling the skin off cooked potato with their fingers
s20OlIRK340_125_138.avi,chef is peeling potato
s20OlIRK340_125_138.avi,person is peeling potato with their hand
s20OlIRK340_125_138.avi,someone peels potato
s20OlIRK340_125_138.avi,woman is peeling boiled potato using her fingers
s20OlIRK340_125_138.avi,the lady peeled the skin off the boiled potatoes
s20OlIRK340_125_138.avi,the woman is peeling potatoes
s20OlIRK340_125_138.avi,boiled potatoes are peeled
s20OlIRK340_125_138.avi,the lady peeled cooked potatoes
s20OlIRK340_125_138.avi,women making aloo bhaji puri
s20OlIRK340_125_138.avi,nice recipe thank youwhat do is cut raw potatoes and them into slices then after braisesweat onions and garlicginger add in my spices then my raw potatoes cubed and cook them
s20OlIRK340_125_138.avi,someone is peeling potatoe
s20OlIRK340_125_138.avi,lady is cooking vegetables
s20OlIRK340_125_138.avi,lady is removing the potato layer
s20OlIRK340_125_138.avi,man is peeling out the potato
s20OlIRK340_125_138.avi,woman is peeling potato by hand
s20OlIRK340_125_138.avi,women is making the indian food
s20OlIRK340_125_138.avi,hok to make indian food
s20OlIRK340_125_138.avi,its looks very delicious after cookingvery nice
s20OlIRK340_125_138.avi,make aloo bhaji poori making very easy method
s20OlIRK340_125_138.avi,someone peels boiled potatoes
K2LxyytY3Dw_104_112.avi,two men are karate kicking each other
K2LxyytY3Dw_104_112.avi,two men engage in choreographed fight
K2LxyytY3Dw_104_112.avi,two men are doing martial arts
K2LxyytY3Dw_104_112.avi,two guys act like theyre fighting
K2LxyytY3Dw_104_112.avi,two men are fighting in park
K2LxyytY3Dw_104_112.avi,two boys are fighting
K2LxyytY3Dw_104_112.avi,two men are kicking each other
K2LxyytY3Dw_104_112.avi,two men kicked at each other in the field
K2LxyytY3Dw_104_112.avi,the men are fighting each other
K2LxyytY3Dw_104_112.avi,two people kick each other
K2LxyytY3Dw_104_112.avi,the two men kick boxed outside
K2LxyytY3Dw_104_112.avi,because all martial come from traditional background so for one for all
K2LxyytY3Dw_104_112.avi,two persons fighting
K2LxyytY3Dw_104_112.avi,fighting stunts
K2LxyytY3Dw_104_112.avi,the men kicked at each other in the field
K2LxyytY3Dw_104_112.avi,they are in some type of play
K2LxyytY3Dw_104_112.avi,two guys are fighting
K2LxyytY3Dw_104_112.avi,two men are kungfu fighting
K2LxyytY3Dw_104_112.avi,two men fighting with each other
lB1UPJ4leqs_1_6.avi,young girl lying in bed appears to wake up
lB1UPJ4leqs_1_6.avi,girl wakes up from bed
lB1UPJ4leqs_1_6.avi,girls wakes up from bed
lB1UPJ4leqs_1_6.avi,little girl is sleeping in bed and then wakes up
lB1UPJ4leqs_1_6.avi,little girl is waking up
lB1UPJ4leqs_1_6.avi,girl is wakening from sleep
lB1UPJ4leqs_1_6.avi,child is waking up
lB1UPJ4leqs_1_6.avi,girl is waking up
lB1UPJ4leqs_1_6.avi,girl wakes up in bed
lB1UPJ4leqs_1_6.avi,the little girl sat up in bed after waking up
lB1UPJ4leqs_1_6.avi,the girl woke up
lB1UPJ4leqs_1_6.avi,woman starts getting out of bed
lB1UPJ4leqs_1_6.avi,child in bed is waking up
lB1UPJ4leqs_1_6.avi,the little girl woke up from her sleep
lB1UPJ4leqs_1_6.avi,girl is laying in her bed
lB1UPJ4leqs_1_6.avi,one little girl is sleeping on bed
lB1UPJ4leqs_1_6.avi,the girl is wake up
lB1UPJ4leqs_1_6.avi,the baby is sleeping
lB1UPJ4leqs_1_6.avi,little girl wakes up in bed
lB1UPJ4leqs_1_6.avi,girl is waking up from bed
lB1UPJ4leqs_1_6.avi,happy to help
lB1UPJ4leqs_1_6.avi,baby is getting on the bed
lB1UPJ4leqs_1_6.avi,the little girl rolled over and sat up
lB1UPJ4leqs_1_6.avi,the girl woke up from sleep
lB1UPJ4leqs_1_6.avi,girl is sitting up
Hd-NeIhbYGc_43_48.avi,woman is riding horse in pasture
Hd-NeIhbYGc_43_48.avi,woman is riding horse without saddle
Hd-NeIhbYGc_43_48.avi,the girl rode her horse in the pen
Hd-NeIhbYGc_43_48.avi,the girl rode her painted horse
Hd-NeIhbYGc_43_48.avi,girl is riding the horse
Hd-NeIhbYGc_43_48.avi,she is jars raiding
Hd-NeIhbYGc_43_48.avi,girl is riding on horse
Hd-NeIhbYGc_43_48.avi,girl riding horse
Hd-NeIhbYGc_43_48.avi,woman riding beautiful horse
Hd-NeIhbYGc_43_48.avi,silence broken by whis perd wind
Hd-NeIhbYGc_43_48.avi,silence broken by whispered wind video
Hd-NeIhbYGc_43_48.avi,the girl rode the painted pony
HkuOqWzXYVg_0_12.avi,baby otter moves about in his glass cage
HkuOqWzXYVg_0_12.avi,baby otter is lying on bed placed within glass enclosure
HkuOqWzXYVg_0_12.avi,baby otter is lying on blanket
HkuOqWzXYVg_0_12.avi,baby otter is playing
HkuOqWzXYVg_0_12.avi,baby otter is rolling around in glass enclosure
HkuOqWzXYVg_0_12.avi,otter is looking through glass wall
HkuOqWzXYVg_0_12.avi,sea otter is sitting on bed
HkuOqWzXYVg_0_12.avi,small animal rolls around on towel
HkuOqWzXYVg_0_12.avi,an otter is in glass box
HkuOqWzXYVg_0_12.avi,an otter is laying on sheet
HkuOqWzXYVg_0_12.avi,an otter is on bed
HkuOqWzXYVg_0_12.avi,an otter plays around on mat
HkuOqWzXYVg_0_12.avi,an otter pup plays near window
HkuOqWzXYVg_0_12.avi,the cat lat on the cot at camp
HkuOqWzXYVg_0_12.avi,the seal was looking out the window
HkuOqWzXYVg_0_12.avi,the cat lay on the cot
HkuOqWzXYVg_0_12.avi,dog is sitting on bed
HkuOqWzXYVg_0_12.avi,otter baby playing in house
HkuOqWzXYVg_0_12.avi,sea baby is playing with the shadow
HkuOqWzXYVg_0_12.avi,an otter is laying down
HkuOqWzXYVg_0_12.avi,at the sea world animal nursery baby otter is being cared for
HkuOqWzXYVg_0_12.avi,baby otter at sea world
HkuOqWzXYVg_0_12.avi,baby otter playing on the bad
HkuOqWzXYVg_0_12.avi,one baby otter lying on bed
HkuOqWzXYVg_0_12.avi,baby is playing in the seashore
HkuOqWzXYVg_0_12.avi,baby otter is lying down
HkuOqWzXYVg_0_12.avi,baby otter laying on bed and admiring the outside view from the glass house
HkuOqWzXYVg_0_12.avi,baby otter lies on towel
HkuOqWzXYVg_0_12.avi,baby otter plays in protected glass cabin
HkuOqWzXYVg_0_12.avi,baby sea otter in glass cage
HkuOqWzXYVg_0_12.avi,animal is playing on the bed
HkuOqWzXYVg_0_12.avi,baby otter in sea
HkuOqWzXYVg_0_12.avi,baby otter is lying on the bed
TsagxA4DKuc_28_41.avi,man is sweeping room
TsagxA4DKuc_28_41.avi,man is cleaning his house
TsagxA4DKuc_28_41.avi,man is sweeping the floor
TsagxA4DKuc_28_41.avi,man is cleaning the house
TsagxA4DKuc_28_41.avi,man sweeps floor with broom
TsagxA4DKuc_28_41.avi,man is sweeping wood floor
TsagxA4DKuc_28_41.avi,man is sweeping the floor of house using long broom
TsagxA4DKuc_28_41.avi,man sweeping the floor
TsagxA4DKuc_28_41.avi,the man swept the empty living room
TsagxA4DKuc_28_41.avi,the man is sweeping the floor
TsagxA4DKuc_28_41.avi,man swept the wooden floor
TsagxA4DKuc_28_41.avi,man cleaning his house
TsagxA4DKuc_28_41.avi,man is cleaning house
TsagxA4DKuc_28_41.avi,man is cleaninmg house
TsagxA4DKuc_28_41.avi,man is sweeping his floor
TsagxA4DKuc_28_41.avi,men cleaning the house
TsagxA4DKuc_28_41.avi,clean house
TsagxA4DKuc_28_41.avi,couples are sweeping the house
TsagxA4DKuc_28_41.avi,people were cleaning the room
TsagxA4DKuc_28_41.avi,they are cleaning the house
TsagxA4DKuc_28_41.avi,girl standing in balcony
TsagxA4DKuc_28_41.avi,guy cleaning house
TsagxA4DKuc_28_41.avi,guy is sweeping the floor
TsagxA4DKuc_28_41.avi,man is cleaning house
TsagxA4DKuc_28_41.avi,man is sweeping floor
TsagxA4DKuc_28_41.avi,man is sweeping the floor clean
TsagxA4DKuc_28_41.avi,man is sweeping the floor with broom
TsagxA4DKuc_28_41.avi,man is sweeping
TsagxA4DKuc_28_41.avi,man sweeping and cleaning the house
TsagxA4DKuc_28_41.avi,man sweeps room with broom
TsagxA4DKuc_28_41.avi,young man is sweeping the floor
TsagxA4DKuc_28_41.avi,cleaning the house
TsagxA4DKuc_28_41.avi,how to keep the house clean
TsagxA4DKuc_28_41.avi,men are cleaning the house
TsagxA4DKuc_28_41.avi,someone is sweeping the floor
TsagxA4DKuc_28_41.avi,the person is cleaning floor
TsagxA4DKuc_28_41.avi,two males are cleaning the floor
TsagxA4DKuc_28_41.avi,two men cleaning the house
TsagxA4DKuc_28_41.avi,guy cleaning his house
TsagxA4DKuc_28_41.avi,the person is cleaning the house
TsagxA4DKuc_28_41.avi,man sweeping the house
DJWmm_Q9WvY_1_25.avi,brown cow is eating grass in an open field
DJWmm_Q9WvY_1_25.avi,cow grazes on grass
DJWmm_Q9WvY_1_25.avi,white cow is grazing on meadow
DJWmm_Q9WvY_1_25.avi,cow eating grass
DJWmm_Q9WvY_1_25.avi,the cow chewed the grass
DJWmm_Q9WvY_1_25.avi,bull is eating grass
DJWmm_Q9WvY_1_25.avi,the cow was eating grass
DJWmm_Q9WvY_1_25.avi,cow is eat some grass
DJWmm_Q9WvY_1_25.avi,cow is eating her food
DJWmm_Q9WvY_1_25.avi,cow eating grass
DJWmm_Q9WvY_1_25.avi,cow is eating the grass from ground
DJWmm_Q9WvY_1_25.avi,one cow eating grass
DJWmm_Q9WvY_1_25.avi,ox foodding
DJWmm_Q9WvY_1_25.avi,the cow is eating grass
DJWmm_Q9WvY_1_25.avi,cow eating grass
DJWmm_Q9WvY_1_25.avi,cow eats grass
DJWmm_Q9WvY_1_25.avi,cow eats some grass
DJWmm_Q9WvY_1_25.avi,cow feeding on green grass
DJWmm_Q9WvY_1_25.avi,cow is eating grass in field
DJWmm_Q9WvY_1_25.avi,cow is eating grass in meadow
DJWmm_Q9WvY_1_25.avi,cow is eating the grass
DJWmm_Q9WvY_1_25.avi,cow is grazing
DJWmm_Q9WvY_1_25.avi,cow taking her meal and enjoying roaming in the fields
DJWmm_Q9WvY_1_25.avi,the cow eating grass very neat
DJWmm_Q9WvY_1_25.avi,the cow eating the grass
DJWmm_Q9WvY_1_25.avi,the cow eats fresh green grass
DJWmm_Q9WvY_1_25.avi,white cow is eating grasses
DJWmm_Q9WvY_1_25.avi,the crow is eating grass
DJWmm_Q9WvY_1_25.avi,cow eating the grass
5zkCnHUnoYY_69_74.avi,young woman standing in front of louvered doors in her bra is brushing her hair
