VideoID,Decription
8mSUD7JGNO0_174_181.avi,woman gallops on horse
8mSUD7JGNO0_174_181.avi,girl is riding horse
8mSUD7JGNO0_174_181.avi,girl rode horse in the barn
8mSUD7JGNO0_174_181.avi,lady is riding horse in barn
8mSUD7JGNO0_174_181.avi,person is keeping their horse at trot
8mSUD7JGNO0_174_181.avi,person is riding horse along the perimeter
8mSUD7JGNO0_174_181.avi,woman is galloping horse around an inside arena
8mSUD7JGNO0_174_181.avi,woman is riding horse in an enlosed covered area
8mSUD7JGNO0_174_181.avi,woman is riding horse
8mSUD7JGNO0_174_181.avi,woman is riding on horse
8mSUD7JGNO0_174_181.avi,the horse and rider trotted around the barn
8mSUD7JGNO0_174_181.avi,the woman is riding horse
8mSUD7JGNO0_174_181.avi,girl is riding horse
8mSUD7JGNO0_174_181.avi,girl is riding in the horse
8mSUD7JGNO0_174_181.avi,girl is sitting on the black horse
8mSUD7JGNO0_174_181.avi,lady riding horse
8mSUD7JGNO0_174_181.avi,man is rading in horse
8mSUD7JGNO0_174_181.avi,men walking on house
8mSUD7JGNO0_174_181.avi,person is riding on horse
8mSUD7JGNO0_174_181.avi,few guys are driving the horses
8mSUD7JGNO0_174_181.avi,fiona my best friend
8mSUD7JGNO0_174_181.avi,one lady riding on horse
8mSUD7JGNO0_174_181.avi,someone is riding horse
8mSUD7JGNO0_174_181.avi,the man is riding horse
8mSUD7JGNO0_174_181.avi,boy riding horse in horse stable
8mSUD7JGNO0_174_181.avi,girl is riding horse inside barn
8mSUD7JGNO0_174_181.avi,girl riding horse
8mSUD7JGNO0_174_181.avi,girl riding with horse
8mSUD7JGNO0_174_181.avi,horse is driven by woman
8mSUD7JGNO0_174_181.avi,lady is riding horse
8mSUD7JGNO0_174_181.avi,man is jogging on the horse
8mSUD7JGNO0_174_181.avi,man is riding on horse
8mSUD7JGNO0_174_181.avi,man is riding on the horse
8mSUD7JGNO0_174_181.avi,man rides horse in the barn
8mSUD7JGNO0_174_181.avi,man riding horse
8mSUD7JGNO0_174_181.avi,person is riding horse inside large building
8mSUD7JGNO0_174_181.avi,person is riding horse
8mSUD7JGNO0_174_181.avi,person rides horse in stable
8mSUD7JGNO0_174_181.avi,woman is riding horse beside wall
8mSUD7JGNO0_174_181.avi,woman is riding horse in barn
8mSUD7JGNO0_174_181.avi,woman is riding around on horse
8mSUD7JGNO0_174_181.avi,woman rides horse inside barn
8mSUD7JGNO0_174_181.avi,the person is raiding the horse
8mSUD7JGNO0_174_181.avi,man is riding in horse
8mSUD7JGNO0_174_181.avi,man practice horse riding
8mSUD7JGNO0_174_181.avi,young girl is riding horse
DBvSfds3FH4_76_80.avi,woman is kneading dough
DBvSfds3FH4_76_80.avi,person is kneading dough
DBvSfds3FH4_76_80.avi,someone is kneading large piece of dough
DBvSfds3FH4_76_80.avi,woman is kneading dough
DBvSfds3FH4_76_80.avi,lwoman is preparing something
DBvSfds3FH4_76_80.avi,woman is kneading dough with her hands
DBvSfds3FH4_76_80.avi,person is mashing dough
DBvSfds3FH4_76_80.avi,person kneads dough with their hands
DBvSfds3FH4_76_80.avi,woman is kneeding dough
DBvSfds3FH4_76_80.avi,woman is kneading some dough
DBvSfds3FH4_76_80.avi,the lady rolled out the dough
DBvSfds3FH4_76_80.avi,the baker is kneading dough
DBvSfds3FH4_76_80.avi,woman is kneading marzipan
DBvSfds3FH4_76_80.avi,chef kneads dough
DBvSfds3FH4_76_80.avi,the lady rolled the dough
DBvSfds3FH4_76_80.avi,one person is cooking
DBvSfds3FH4_76_80.avi,the person is cooking
DBvSfds3FH4_76_80.avi,woman in white top holding cake
DBvSfds3FH4_76_80.avi,person is making cake
DBvSfds3FH4_76_80.avi,girl is making aatta
DBvSfds3FH4_76_80.avi,woman is kneeding some dough
DBvSfds3FH4_76_80.avi,man is mixing meal
DBvSfds3FH4_76_80.avi,man coking cake
DBvSfds3FH4_76_80.avi,someone is kneading dough
DBvSfds3FH4_76_80.avi,person is preparing for cake
DBvSfds3FH4_76_80.avi,one man rooling bread with pastry roller
DBvSfds3FH4_76_80.avi,woman showing cake
DBvSfds3FH4_76_80.avi,the man is kneading dough
DBvSfds3FH4_76_80.avi,how to make wedding cake
DBvSfds3FH4_76_80.avi,women is made cake
DBvSfds3FH4_76_80.avi,icing wedding cake video
DBvSfds3FH4_76_80.avi,woman is pressing dough
Xh6rdpJNaf0_0_15.avi,bunny is licking itself
Xh6rdpJNaf0_0_15.avi,rabbit is sitting on wooden ledge licking its front paws
Xh6rdpJNaf0_0_15.avi,rabbit is cleaning itself
Xh6rdpJNaf0_0_15.avi,rabbit is grooming itself
Xh6rdpJNaf0_0_15.avi,rabbit is licking its legs
Xh6rdpJNaf0_0_15.avi,bunny is cleaning itself
Xh6rdpJNaf0_0_15.avi,bunny is nibbling food in its paws
Xh6rdpJNaf0_0_15.avi,rabbit rubs its head with its paws
Xh6rdpJNaf0_0_15.avi,bunny rabbit is licking its paws
Xh6rdpJNaf0_0_15.avi,bunny is licking its paws
Xh6rdpJNaf0_0_15.avi,white rabbit sits at doorway
Xh6rdpJNaf0_0_15.avi,the white rabbit cleaned its face with its paw
Xh6rdpJNaf0_0_15.avi,rabbit sits outside of door licking his paws
Xh6rdpJNaf0_0_15.avi,the rabbit is cleaning his paws
Xh6rdpJNaf0_0_15.avi,rabbit wipes its face
Xh6rdpJNaf0_0_15.avi,rabbit grooms itself
Xh6rdpJNaf0_0_15.avi,the white rabit washed his face with his paw
Xh6rdpJNaf0_0_15.avi,small white rabbit sitting infront of house door awaiting for it to open
Xh6rdpJNaf0_0_15.avi,the rabbit is rubbing mouth
Xh6rdpJNaf0_0_15.avi,rabbit
Xh6rdpJNaf0_0_15.avi,rabbit inching it self
Xh6rdpJNaf0_0_15.avi,rabbit is itching its face
Xh6rdpJNaf0_0_15.avi,the rabbit is eating
Xh6rdpJNaf0_0_15.avi,rabbit is grooming
Xh6rdpJNaf0_0_15.avi,rabit is playing
Xh6rdpJNaf0_0_15.avi,rabbit is eating something near wooden fence
Xh6rdpJNaf0_0_15.avi,rabbit is licking its palm
Xh6rdpJNaf0_0_15.avi,rabbit is cleaning its face
Xh6rdpJNaf0_0_15.avi,rabbit scrabbling
6owu8Mow0_g_302_307.avi,man puts cheese on pizza
6owu8Mow0_g_302_307.avi,man is sprinkling shredded cheese on pizza
6owu8Mow0_g_302_307.avi,man is spreading shredded cheese on an uncooked pizza
6owu8Mow0_g_302_307.avi,man is spreading shreded cheese on pizza
6owu8Mow0_g_302_307.avi,cook spreads cheese onto raw pizza crust
6owu8Mow0_g_302_307.avi,man is putting shredded cheese on two pizzas
6owu8Mow0_g_302_307.avi,man is making pizza
6owu8Mow0_g_302_307.avi,man is sprinkling something to pizza
6owu8Mow0_g_302_307.avi,man is putting shredded cheese on pizza
6owu8Mow0_g_302_307.avi,person is spreading cheese on pizza
6owu8Mow0_g_302_307.avi,man is putting cheese on pizza
6owu8Mow0_g_302_307.avi,men are making pizza
6owu8Mow0_g_302_307.avi,man is adding cheese to pizza crust
6owu8Mow0_g_302_307.avi,man sprinkles cheese on top of pizza
6owu8Mow0_g_302_307.avi,the man spread cheese on the pizza
6owu8Mow0_g_302_307.avi,the cook is spreading cheese on the pizza dough
6owu8Mow0_g_302_307.avi,man puts some cheese on pizza
6owu8Mow0_g_302_307.avi,the man sprinkled cheese on the pizza
6owu8Mow0_g_302_307.avi,man sprinkles cheese on pizza
6owu8Mow0_g_302_307.avi,man is making pizza
6owu8Mow0_g_302_307.avi,man is spreading the cheese grating in to pizza
6owu8Mow0_g_302_307.avi,man coking pizzas
6owu8Mow0_g_302_307.avi,someone is making pizzas
6owu8Mow0_g_302_307.avi,person is preparing pizzas
6owu8Mow0_g_302_307.avi,the man is putting cheese on the pizza
6owu8Mow0_g_302_307.avi,men is making pizza
6owu8Mow0_g_302_307.avi,very very clear detail for pizza wars
6owu8Mow0_g_302_307.avi,man is spreading cheese on pizza
9W6aQNcU3PA_92_103.avi,the lady is filing her nails
9W6aQNcU3PA_92_103.avi,someone is filing their fingernails with an emery board
9W6aQNcU3PA_92_103.avi,person is filing her nails
9W6aQNcU3PA_92_103.avi,woman is filing her fingernails with an emery board
9W6aQNcU3PA_92_103.avi,woman is filing her fingernail using an emery board
9W6aQNcU3PA_92_103.avi,woman is shaping her nails
9W6aQNcU3PA_92_103.avi,woman files her nails
9W6aQNcU3PA_92_103.avi,girl is filing her fingernails
9W6aQNcU3PA_92_103.avi,woman is styling her nails
9W6aQNcU3PA_92_103.avi,woman is filing her nails
9W6aQNcU3PA_92_103.avi,woman files her fingernails
9W6aQNcU3PA_92_103.avi,girl is filing her nails
9W6aQNcU3PA_92_103.avi,woman is filing her fingernails
9W6aQNcU3PA_92_103.avi,the lady filed her nails
9W6aQNcU3PA_92_103.avi,the woman is filing her nails
9W6aQNcU3PA_92_103.avi,person uses nail file
9W6aQNcU3PA_92_103.avi,lady filed her nails
9W6aQNcU3PA_92_103.avi,woman trimming her nails
9W6aQNcU3PA_92_103.avi,one person make the shape nails
9W6aQNcU3PA_92_103.avi,she is shaping the nils
9W6aQNcU3PA_92_103.avi,woman files fingernail
9W6aQNcU3PA_92_103.avi,woman is filing her finger nails on an emory board
9W6aQNcU3PA_92_103.avi,nails painted blue
9W6aQNcU3PA_92_103.avi,the person is polishing nails
9W6aQNcU3PA_92_103.avi,woman is filing her long fingernails
9W6aQNcU3PA_92_103.avi,girl is correcting her nails
9W6aQNcU3PA_92_103.avi,woman is filing her finger nails
9W6aQNcU3PA_92_103.avi,someone is filing his or her nails
9W6aQNcU3PA_92_103.avi,somebody is shaping the nails
9W6aQNcU3PA_92_103.avi,lady giving shape to their nails with nail shaper
9W6aQNcU3PA_92_103.avi,the lady filed her painted nails
9W6aQNcU3PA_92_103.avi,women is painting her nails
JK1R9k1WDpc_6_15.avi,herd of elephants are walking single file down path
JK1R9k1WDpc_6_15.avi,elephants are walking in line
JK1R9k1WDpc_6_15.avi,herd of elephants are walking on path
JK1R9k1WDpc_6_15.avi,elephants are running in the wood
JK1R9k1WDpc_6_15.avi,group of elephants are moving down trail
JK1R9k1WDpc_6_15.avi,elephants are running down hill
JK1R9k1WDpc_6_15.avi,herd of elephants are going down hill
JK1R9k1WDpc_6_15.avi,elephants are walking down trail
JK1R9k1WDpc_6_15.avi,elephants are migrating
JK1R9k1WDpc_6_15.avi,elephants are walking
JK1R9k1WDpc_6_15.avi,herd of elephants are walking along trail
JK1R9k1WDpc_6_15.avi,the elephants walked one by one on the path
JK1R9k1WDpc_6_15.avi,the elephants are walking down path
JK1R9k1WDpc_6_15.avi,herd of elephants are walking along path
JK1R9k1WDpc_6_15.avi,elephants walk down path
JK1R9k1WDpc_6_15.avi,the elephants followed their leader
JK1R9k1WDpc_6_15.avi,the elephants are running
JK1R9k1WDpc_6_15.avi,elephents are ruuning
JK1R9k1WDpc_6_15.avi,the elephants walking the forest
JK1R9k1WDpc_6_15.avi,elephants are running
JK1R9k1WDpc_6_15.avi,elephants roaming in the forest
JK1R9k1WDpc_6_15.avi,elephants are running
JK1R9k1WDpc_6_15.avi,elephants are traveling in line
JK1R9k1WDpc_6_15.avi,many elephants are walking
JK1R9k1WDpc_6_15.avi,running elephant is successfull job
JK1R9k1WDpc_6_15.avi,strugling for servival
JK1R9k1WDpc_6_15.avi,some elephant walking in the forest
JK1R9k1WDpc_6_15.avi,some elephants are walking in line
JK1R9k1WDpc_6_15.avi,the elephants are marching in line
JK1R9k1WDpc_6_15.avi,chunk of elephnats are running down the hill
JK1R9k1WDpc_6_15.avi,group of elephant is going
JK1R9k1WDpc_6_15.avi,herd of elephants is walking down dirt path
JK1R9k1WDpc_6_15.avi,the elephants are running
JK1R9k1WDpc_6_15.avi,group of elephants running on road through out the jungle
JK1R9k1WDpc_6_15.avi,the elephants are walking
JK1R9k1WDpc_6_15.avi,group of elephants are walking
klteYv1Uv9A_27_33.avi,man is lying back on moving motorcycle
klteYv1Uv9A_27_33.avi,man is riding motorcycle while laying down
klteYv1Uv9A_27_33.avi,man laying down is riding motorcycle
klteYv1Uv9A_27_33.avi,man is riding motorcycle
klteYv1Uv9A_27_33.avi,man reclines and talks on phone while motorcycling
klteYv1Uv9A_27_33.avi,man is riding motorcycle without holding onto the handles
klteYv1Uv9A_27_33.avi,man is doing motor bike stunts
klteYv1Uv9A_27_33.avi,someone is riding motorcycle
klteYv1Uv9A_27_33.avi,man is riding motorcycle with no hands
klteYv1Uv9A_27_33.avi,guy is riding motocycle
klteYv1Uv9A_27_33.avi,man is riding motorcycle
klteYv1Uv9A_27_33.avi,the man is on his back riding motorcycle
klteYv1Uv9A_27_33.avi,man is riding motorcycle while lying back
klteYv1Uv9A_27_33.avi,man rides motor scooter in an unusual way
klteYv1Uv9A_27_33.avi,the man lounged on his motorcycle as it moved down the street
klteYv1Uv9A_27_33.avi,man is driving bike in amazing style
klteYv1Uv9A_27_33.avi,man is laying down while riding his motorcycle
klteYv1Uv9A_27_33.avi,man riding the byke
klteYv1Uv9A_27_33.avi,someone riding bike
klteYv1Uv9A_27_33.avi,the person is doing feat on bike
klteYv1Uv9A_27_33.avi,the man riding the bicycle with challanging the busy road
klteYv1Uv9A_27_33.avi,guy is laying on motorcycle
klteYv1Uv9A_27_33.avi,man is laying down on motorcycle
klteYv1Uv9A_27_33.avi,man riding bike
klteYv1Uv9A_27_33.avi,person is riding the bick with legs
klteYv1Uv9A_27_33.avi,the man is doing motorcycle tricks
klteYv1Uv9A_27_33.avi,the man laid back on his motorcycle as it traveled down the road
klteYv1Uv9A_27_33.avi,this video is man sittin on vehical
OpR1Er5o6IY_209_217.avi,man dangles mouse for snake to eat
OpR1Er5o6IY_209_217.avi,man grabs live rat out of snakes cage
OpR1Er5o6IY_209_217.avi,man holds white rat close to his face after touching it to snakes body in glass enclosure
OpR1Er5o6IY_209_217.avi,man is dangling live mouse for snake to eat
OpR1Er5o6IY_209_217.avi,man is dangling mouse near snake
OpR1Er5o6IY_209_217.avi,man is feeding mice to snake
OpR1Er5o6IY_209_217.avi,man is feeding mouse to snake
OpR1Er5o6IY_209_217.avi,man is feeding rat to snake
OpR1Er5o6IY_209_217.avi,man is holding white rat by its tale over an aquarium containing large snake
OpR1Er5o6IY_209_217.avi,man is showing rat to snake
OpR1Er5o6IY_209_217.avi,man is teasing snake with mouse
OpR1Er5o6IY_209_217.avi,man is trying to fed snake mouse
OpR1Er5o6IY_209_217.avi,man picks up mouse from case holding snake
OpR1Er5o6IY_209_217.avi,man tries to feed mouse to snake
OpR1Er5o6IY_209_217.avi,the man is feeding mouse to the snake
OpR1Er5o6IY_209_217.avi,the man is trying to feed the snake with mouse
OpR1Er5o6IY_209_217.avi,the man teased snake with live mouse
OpR1Er5o6IY_209_217.avi,the man tried to feed live mouse to snake
OpR1Er5o6IY_209_217.avi,man playing with rat and snake
OpR1Er5o6IY_209_217.avi,the man is keeping food to snakes
OpR1Er5o6IY_209_217.avi,man is trying to feed mouse to snake
OpR1Er5o6IY_209_217.avi,man is dangling mouse to feed snake
OpR1Er5o6IY_209_217.avi,this is road trip
OpR1Er5o6IY_209_217.avi,man is touching the snake with mouse
OpR1Er5o6IY_209_217.avi,the man is giving rat to the snake
OpR1Er5o6IY_209_217.avi,the person is playing with the rat
OpR1Er5o6IY_209_217.avi,man is playing with snake
OpR1Er5o6IY_209_217.avi,man is playing with snake
OpR1Er5o6IY_209_217.avi,man is trying to feed snake
OpR1Er5o6IY_209_217.avi,man playing with snake
OpR1Er5o6IY_209_217.avi,man giving food of rat to snake
OpR1Er5o6IY_209_217.avi,man is playing with mouse and snake
OpR1Er5o6IY_209_217.avi,the man is feeding snake
OpR1Er5o6IY_209_217.avi,mans road trip where he is talking with lots of people about particular concept
OpR1Er5o6IY_209_217.avi,man is showing rat to the snake
OpR1Er5o6IY_209_217.avi,man tickles the snake with live rat
OpR1Er5o6IY_209_217.avi,the man is mouse to the snake
OpR1Er5o6IY_209_217.avi,man is holding rat
OpR1Er5o6IY_209_217.avi,man is dangling mouse at snake
OpR1Er5o6IY_209_217.avi,man offers struggling mouse to snake
crfrKqFp0Zg_15_25.avi,man is playing flute
crfrKqFp0Zg_15_25.avi,man is playing flute
crfrKqFp0Zg_15_25.avi,man is playing the flute
crfrKqFp0Zg_15_25.avi,man plays flute
crfrKqFp0Zg_15_25.avi,man plays the flute
crfrKqFp0Zg_15_25.avi,the man is playing the flute
crfrKqFp0Zg_15_25.avi,the man played his flute
crfrKqFp0Zg_15_25.avi,un barbat canta la fluier melodia din super mario
crfrKqFp0Zg_15_25.avi,man is blowing flute
crfrKqFp0Zg_15_25.avi,man in black tshirt playing flute
crfrKqFp0Zg_15_25.avi,the man is play the mega flute
crfrKqFp0Zg_15_25.avi,he is the real super marioyour hardwork will reach you at the pinpoint of the peak
crfrKqFp0Zg_15_25.avi,man is blowing the flute
crfrKqFp0Zg_15_25.avi,person is playing musical instrument
crfrKqFp0Zg_15_25.avi,man is playing beatboxing flute
crfrKqFp0Zg_15_25.avi,man is playing flute
crfrKqFp0Zg_15_25.avi,musician playing flute in concert
crfrKqFp0Zg_15_25.avi,man is playing some notes on flute
crfrKqFp0Zg_15_25.avi,man plays flute
crfrKqFp0Zg_15_25.avi,the man is playing flute
crfrKqFp0Zg_15_25.avi,really very super music for flute
crfrKqFp0Zg_15_25.avi,man plays the super mario bros theme song on flute while beat boxing
c75SIlAjfjg_6_14.avi,several children practice their routine onstage
c75SIlAjfjg_6_14.avi,group of children are dancing on stage
c75SIlAjfjg_6_14.avi,group of children dance onstage
c75SIlAjfjg_6_14.avi,group of kids are dancing
c75SIlAjfjg_6_14.avi,small group of children are dancing to music on the stage
c75SIlAjfjg_6_14.avi,children are dancing on stage
c75SIlAjfjg_6_14.avi,children are dancing on stage
c75SIlAjfjg_6_14.avi,children are singing and dancing
c75SIlAjfjg_6_14.avi,four small children are on stage performing while an adult stands to the side watching
c75SIlAjfjg_6_14.avi,kids are dancing on stage
c75SIlAjfjg_6_14.avi,kids are dancing onstage
c75SIlAjfjg_6_14.avi,kids dance on stage
c75SIlAjfjg_6_14.avi,little kids are dancing to music on stage
c75SIlAjfjg_6_14.avi,the babies are dancing on stage
c75SIlAjfjg_6_14.avi,the children danced on the stage
c75SIlAjfjg_6_14.avi,the little children danced on the stage
c75SIlAjfjg_6_14.avi,group of little kids are dancing on stage
c75SIlAjfjg_6_14.avi,children proforming on the stage
c75SIlAjfjg_6_14.avi,children are dancing
c75SIlAjfjg_6_14.avi,kids practicing dance
c75SIlAjfjg_6_14.avi,some childern dancing on the stage
c75SIlAjfjg_6_14.avi,the childs funny program
c75SIlAjfjg_6_14.avi,the little babies are dancing in the school program
c75SIlAjfjg_6_14.avi,group of kids are performing dance on stage
c75SIlAjfjg_6_14.avi,group of small kids are performing on the stage
c75SIlAjfjg_6_14.avi,all small children are dancing
c75SIlAjfjg_6_14.avi,an adult and five children are dancing on stage
c75SIlAjfjg_6_14.avi,babys are playing
c75SIlAjfjg_6_14.avi,childern are dancing in stage
c75SIlAjfjg_6_14.avi,children are dancing
c75SIlAjfjg_6_14.avi,children are performing on stage
c75SIlAjfjg_6_14.avi,children were dancing in the stage
c75SIlAjfjg_6_14.avi,childrens performing in play on stage
c75SIlAjfjg_6_14.avi,five toddlers dance on stage
c75SIlAjfjg_6_14.avi,kids are dancing
c75SIlAjfjg_6_14.avi,kids are dancing
c75SIlAjfjg_6_14.avi,kids are performing
c75SIlAjfjg_6_14.avi,little children performing on stage
c75SIlAjfjg_6_14.avi,little kids performing on the stage
c75SIlAjfjg_6_14.avi,several children are dancing on stage
c75SIlAjfjg_6_14.avi,some children are singing on stage
c75SIlAjfjg_6_14.avi,the children are dancing
c75SIlAjfjg_6_14.avi,the kids are performing on stage
c75SIlAjfjg_6_14.avi,the small kids are dancing
c75SIlAjfjg_6_14.avi,young children are dancing and performing on stage
c75SIlAjfjg_6_14.avi,kisds are dancing to the song
c75SIlAjfjg_6_14.avi,dance program by childs
c75SIlAjfjg_6_14.avi,the children dancing
0hyZ__3YhZc_410_417.avi,someone is pouring chili powder into measuring spoon and adds it to kettle of chili
0hyZ__3YhZc_410_417.avi,man seasons chili bowl
0hyZ__3YhZc_410_417.avi,man seasons pot of chili
0hyZ__3YhZc_410_417.avi,person is adding spoon of chili powder in food
0hyZ__3YhZc_410_417.avi,someone is putting seasonings into pot of beans
0hyZ__3YhZc_410_417.avi,man is adding spice to cooking bowl
0hyZ__3YhZc_410_417.avi,person is adding chili powder to chili with beans
0hyZ__3YhZc_410_417.avi,man is adding spice to something in pan
0hyZ__3YhZc_410_417.avi,man is adding chili powder to pot of chili
0hyZ__3YhZc_410_417.avi,someone is seasoning beans
0hyZ__3YhZc_410_417.avi,person is adding seasoning to some chili
0hyZ__3YhZc_410_417.avi,man adds tablespoon of chili powder to pan containing mixture of beans and tomato paste
0hyZ__3YhZc_410_417.avi,the man added chili powder to the chili
0hyZ__3YhZc_410_417.avi,the man is adding seasoning to the beans
0hyZ__3YhZc_410_417.avi,person seasons some chili
0hyZ__3YhZc_410_417.avi,someone added cayenne pepper to the chili
0hyZ__3YhZc_410_417.avi,person is making some food items
0hyZ__3YhZc_410_417.avi,the person show how to prepare the bean vebeterian chilli
0hyZ__3YhZc_410_417.avi,person is preparing
0hyZ__3YhZc_410_417.avi,someone is putting spices into pot
0hyZ__3YhZc_410_417.avi,one man is sprinkling red chili on gravy
0hyZ__3YhZc_410_417.avi,man is adding condiments to food
0hyZ__3YhZc_410_417.avi,man is measuring spices
0hyZ__3YhZc_410_417.avi,some one is cooking food
0hyZ__3YhZc_410_417.avi,man is saying about hoe to make spicy vegetarian chili
0hyZ__3YhZc_410_417.avi,the man is seasoning the beans
0hyZ__3YhZc_410_417.avi,man is adding spices to pot on the stove
0hyZ__3YhZc_410_417.avi,man is adding some spice into pan
0hyZ__3YhZc_410_417.avi,she is cooking the something
ao-9B8IV9_E_175_187.avi,dog walks over kid who is inside his house
ao-9B8IV9_E_175_187.avi,boy gets stuck in dog house
ao-9B8IV9_E_175_187.avi,boy is crawling into dog house
ao-9B8IV9_E_175_187.avi,boy is squeezing through dog house
ao-9B8IV9_E_175_187.avi,bull dog is standing over boy
ao-9B8IV9_E_175_187.avi,child is stuck in dog door opening
ao-9B8IV9_E_175_187.avi,child is stuck in dog house
ao-9B8IV9_E_175_187.avi,dog and toddler are trying to get out of dog house
ao-9B8IV9_E_175_187.avi,dog is climbing over boy to get out of playhouse
ao-9B8IV9_E_175_187.avi,kid and dog are playing in dog house
ao-9B8IV9_E_175_187.avi,little boy gets stuck in dog house
ao-9B8IV9_E_175_187.avi,man lying down is stuck midway through the entrance of kennel while his dog steps on him and comes out
ao-9B8IV9_E_175_187.avi,monkey is walking
ao-9B8IV9_E_175_187.avi,an animal plays with child
ao-9B8IV9_E_175_187.avi,the boy is stuck in the door of the doghouse
ao-9B8IV9_E_175_187.avi,the little boy tried to get in the doghouse and the dog tried to get out
ao-9B8IV9_E_175_187.avi,the toddler went inside the dog house and the dog came out
ao-9B8IV9_E_175_187.avi,while child is trying to get into doghouse the dog is trying to get out
ao-9B8IV9_E_175_187.avi,animal pick the child
ao-9B8IV9_E_175_187.avi,boy playing with dog
ao-9B8IV9_E_175_187.avi,dog drag child in the house
ao-9B8IV9_E_175_187.avi,little baby with puppy
ao-9B8IV9_E_175_187.avi,monkey is inside the cage
ao-9B8IV9_E_175_187.avi,an animal is playing with the pipe
ao-9B8IV9_E_175_187.avi,dog climbs over mand in his dog house
ao-9B8IV9_E_175_187.avi,one little baby and puppy looking very funny
ao-9B8IV9_E_175_187.avi,they are the funny animals
ao-9B8IV9_E_175_187.avi,baby and dog are stuck in dog house
ao-9B8IV9_E_175_187.avi,child and dog are stuck in the entrance of dog house
ao-9B8IV9_E_175_187.avi,child climbing into doghouse
ao-9B8IV9_E_175_187.avi,child is getting into doghouse
ao-9B8IV9_E_175_187.avi,dog is crawling over child to get out of its doghouse
ao-9B8IV9_E_175_187.avi,dog is on top of person in his kennel
ao-9B8IV9_E_175_187.avi,funny animal
ao-9B8IV9_E_175_187.avi,kid and dog stuck in doghouse
ao-9B8IV9_E_175_187.avi,kid is playing in dog house
ao-9B8IV9_E_175_187.avi,little boy is crawling into dog house
ao-9B8IV9_E_175_187.avi,small boy got caught in dogs kennel
ao-9B8IV9_E_175_187.avi,toddler crawls into dog house
ao-9B8IV9_E_175_187.avi,its funniest clip of dog and man
ao-9B8IV9_E_175_187.avi,the dog biting man
ao-9B8IV9_E_175_187.avi,the dog is playing with the boy
ao-9B8IV9_E_175_187.avi,the boy is play the funny animals
BIqVvRh_cEY_143_149.avi,young boy is running
BIqVvRh_cEY_143_149.avi,boy is running
BIqVvRh_cEY_143_149.avi,child is sprinting
BIqVvRh_cEY_143_149.avi,boy is running down the hall
BIqVvRh_cEY_143_149.avi,boy runs down hallway
BIqVvRh_cEY_143_149.avi,kid is running
BIqVvRh_cEY_143_149.avi,boy is running around track
BIqVvRh_cEY_143_149.avi,the boy ran around the gate
BIqVvRh_cEY_143_149.avi,the boy is running
BIqVvRh_cEY_143_149.avi,boy runs along hallway
BIqVvRh_cEY_143_149.avi,the boy ran along the fence
BIqVvRh_cEY_143_149.avi,amazing old athlete foot ball plyingso much
BIqVvRh_cEY_143_149.avi,boy is running on the floor
BIqVvRh_cEY_143_149.avi,boy running around the corner
BIqVvRh_cEY_143_149.avi,boy runs
BIqVvRh_cEY_143_149.avi,girl is weeping
BIqVvRh_cEY_143_149.avi,girl running
BIqVvRh_cEY_143_149.avi,kid running on track
BIqVvRh_cEY_143_149.avi,kid runs
BIqVvRh_cEY_143_149.avi,the boy ran around the fence
BIqVvRh_cEY_143_149.avi,the boy is running way
BIqVvRh_cEY_143_149.avi,girl is playing with football
TwQzFqBqgeA_0_10.avi,man is relaxing on the beach
TwQzFqBqgeA_0_10.avi,man is sitting in the sand
TwQzFqBqgeA_0_10.avi,man is sitting on beach looking out at the water
TwQzFqBqgeA_0_10.avi,man is sitting on beach
TwQzFqBqgeA_0_10.avi,man is sitting on seashore
TwQzFqBqgeA_0_10.avi,man is sitting on the beach watching people in the water
TwQzFqBqgeA_0_10.avi,man is sitting on the beach watching people play in the water
TwQzFqBqgeA_0_10.avi,man is sitting on the beach with his legs outstretched and watching other people ahead in the water
TwQzFqBqgeA_0_10.avi,man is sitting on the beach
TwQzFqBqgeA_0_10.avi,man is sitting on the shore of beach
TwQzFqBqgeA_0_10.avi,man is watching the ocean while sitting on the beach
TwQzFqBqgeA_0_10.avi,man laying in the sand
TwQzFqBqgeA_0_10.avi,man sits in the sand by the water
TwQzFqBqgeA_0_10.avi,man sits on the beach and stares at the water
TwQzFqBqgeA_0_10.avi,man sitting at the beach
TwQzFqBqgeA_0_10.avi,man watched the swimmers in the lake
TwQzFqBqgeA_0_10.avi,several beachgoers wade in shallow water as another watches from the beach
TwQzFqBqgeA_0_10.avi,the man is sitting on the beach watchint the swimmers
TwQzFqBqgeA_0_10.avi,the man is sitting on the beach
TwQzFqBqgeA_0_10.avi,male is sitting on the beach sand watching others play in the water
TwQzFqBqgeA_0_10.avi,guy is sitting on the sea shore
TwQzFqBqgeA_0_10.avi,man views the beach
TwQzFqBqgeA_0_10.avi,some people enjoying near the beach
TwQzFqBqgeA_0_10.avi,man is sitting on beach watching others who are wading in the ocean
TwQzFqBqgeA_0_10.avi,man is sitting on sand
TwQzFqBqgeA_0_10.avi,men sit near the see
TwQzFqBqgeA_0_10.avi,tourist are enjoying at the egypt hurghada red sea
TwQzFqBqgeA_0_10.avi,man sitting by the shore and enjoying the view
