VideoID,Decription
5zkCnHUnoYY_69_74.avi,woman is combing her hair
5zkCnHUnoYY_69_74.avi,woman is brushing her hair
5zkCnHUnoYY_69_74.avi,woman brushes her hair
5zkCnHUnoYY_69_74.avi,woman in bra is brushing her hair
5zkCnHUnoYY_69_74.avi,the lady brushed her hair
5zkCnHUnoYY_69_74.avi,the woman is brushing her hair
5zkCnHUnoYY_69_74.avi,woman in her bra is brushing her hair
5zkCnHUnoYY_69_74.avi,the lady brushed her long hair
5zkCnHUnoYY_69_74.avi,she is doing the hair clean
5zkCnHUnoYY_69_74.avi,the women is make up
5zkCnHUnoYY_69_74.avi,the girl is combing her hair
5zkCnHUnoYY_69_74.avi,story about girl who went all the way for living
5zkCnHUnoYY_69_74.avi,documentary about teenage girls who start having intimate relations and get pregnant
5zkCnHUnoYY_69_74.avi,movie trailer of teenage mother
5zkCnHUnoYY_69_74.avi,teenager girl showing demo of her beauty
5zkCnHUnoYY_69_74.avi,lady is dancing
EA-J-Y6QjUo_40_61.avi,cat opens drawer and climbs in
EA-J-Y6QjUo_40_61.avi,big cat opens plastic drawer with his paws and then hops inside
EA-J-Y6QjUo_40_61.avi,cat climbs into drawer
EA-J-Y6QjUo_40_61.avi,cat has opened drawer and entered inside
EA-J-Y6QjUo_40_61.avi,cat is climbing into storage box
EA-J-Y6QjUo_40_61.avi,cat is opening box
EA-J-Y6QjUo_40_61.avi,cat is opening draw and climbing into it
EA-J-Y6QjUo_40_61.avi,cat is opening drawer and climbing inside
EA-J-Y6QjUo_40_61.avi,cat is opening drawer
EA-J-Y6QjUo_40_61.avi,cat opens drawer and climbs inside
EA-J-Y6QjUo_40_61.avi,cat opens drawer and climbs into it
EA-J-Y6QjUo_40_61.avi,cat opens the drawer of storage box and squeezes into it
EA-J-Y6QjUo_40_61.avi,cat pulls plastic drawer out
EA-J-Y6QjUo_40_61.avi,grey cat opens cabinet draw with his left fore paw and thereafter enters the draw
EA-J-Y6QjUo_40_61.avi,the cat opened drawer and climbed inside
EA-J-Y6QjUo_40_61.avi,the cat opened and climbed into the drawer
EA-J-Y6QjUo_40_61.avi,the cat opened the drawer and got inside
EA-J-Y6QjUo_40_61.avi,the cat is playing with box
EA-J-Y6QjUo_40_61.avi,the cat is inside the box
EA-J-Y6QjUo_40_61.avi,cat is opening the the desk
EA-J-Y6QjUo_40_61.avi,cat is checking box
EA-J-Y6QjUo_40_61.avi,cat is seaching something in box
EA-J-Y6QjUo_40_61.avi,cat is opening drawer and crawling inside it
EA-J-Y6QjUo_40_61.avi,cat is trying to go to inside the box
EA-J-Y6QjUo_40_61.avi,cat opening the box
EA-J-Y6QjUo_40_61.avi,cat climbs in drawer
EA-J-Y6QjUo_40_61.avi,cat pulling drawer and goes to sleep in it
EA-J-Y6QjUo_40_61.avi,the cat searching in desk
EA-J-Y6QjUo_40_61.avi,cat pulling out drawer
EA-J-Y6QjUo_40_61.avi,cat is playing with the box
EA-J-Y6QjUo_40_61.avi,cat opens plastic drawer and climbs in
EA-J-Y6QjUo_40_61.avi,cat search box
EA-J-Y6QjUo_40_61.avi,cat open the drawer
EA-J-Y6QjUo_40_61.avi,cat is opening plastic storage drawer and climbing inside
EA-J-Y6QjUo_40_61.avi,cat is opening and crawling inside of drawer
EA-J-Y6QjUo_40_61.avi,cat opens and gets inside drawer
zv2RIbUsnSw_159_162.avi,girl and boy are sliding down water slide
zv2RIbUsnSw_159_162.avi,children are sliding
zv2RIbUsnSw_159_162.avi,children are sliding on plastic
zv2RIbUsnSw_159_162.avi,two kids are sliding down slope that is covered with sheet of wet plastic
zv2RIbUsnSw_159_162.avi,couple of kids are sliding down hill on wet tarp
zv2RIbUsnSw_159_162.avi,girl is sliding
zv2RIbUsnSw_159_162.avi,children are sliding on black tarp
zv2RIbUsnSw_159_162.avi,two kids slide down slip slide
zv2RIbUsnSw_159_162.avi,two children are sliding
zv2RIbUsnSw_159_162.avi,some kids are going down water slide
zv2RIbUsnSw_159_162.avi,two children are sliding down some plastic
zv2RIbUsnSw_159_162.avi,the kids are moving down the water slide
zv2RIbUsnSw_159_162.avi,kids slide down water slide
zv2RIbUsnSw_159_162.avi,the kids slide down the wet plastic slide
zv2RIbUsnSw_159_162.avi,the girls are playing the water
zv2RIbUsnSw_159_162.avi,two children on slip and slide
zv2RIbUsnSw_159_162.avi,the children are playing
zv2RIbUsnSw_159_162.avi,two kids are sliding down tarp
zv2RIbUsnSw_159_162.avi,two kids sliding down water slide
zv2RIbUsnSw_159_162.avi,children are sliding down wet tarp
zv2RIbUsnSw_159_162.avi,two children playing and sliding on some sort of polithin
zv2RIbUsnSw_159_162.avi,the kids slid down the wet plastic
zv2RIbUsnSw_159_162.avi,the kids went down the water slide
zv2RIbUsnSw_159_162.avi,kids are sliding down wet tarp
3chNlP5TeO8_0_10.avi,plane shoots out of water
3chNlP5TeO8_0_10.avi,plane flies out of the sea
3chNlP5TeO8_0_10.avi,missile emerges from underwater and streaks across the sky
3chNlP5TeO8_0_10.avi,jet ascends from the ocean
3chNlP5TeO8_0_10.avi,jet is flying up out of the water into the sky
3chNlP5TeO8_0_10.avi,jet came out of water
3chNlP5TeO8_0_10.avi,plane is launching from water
3chNlP5TeO8_0_10.avi,jet emerges from the ocean and soars straight up into the air
3chNlP5TeO8_0_10.avi,jet is flying out of the ocean
3chNlP5TeO8_0_10.avi,plane appears to fly out of the ocean
3chNlP5TeO8_0_10.avi,jet is launching from the ocean
3chNlP5TeO8_0_10.avi,jet bursting out of the ocean
3chNlP5TeO8_0_10.avi,jet is flying into the air
3chNlP5TeO8_0_10.avi,jet takes off from the ocean
3chNlP5TeO8_0_10.avi,the rock screamed out of the ocean into the sky
3chNlP5TeO8_0_10.avi,the jet flew up out of the ocean
3chNlP5TeO8_0_10.avi,plane comes out of the water and flies up
3chNlP5TeO8_0_10.avi,the missle flew into the sky from below the ocean
3chNlP5TeO8_0_10.avi,the rocket is in the space
3chNlP5TeO8_0_10.avi,plane flies out of hte water
3chNlP5TeO8_0_10.avi,an military jet comes out of the water and flies
3chNlP5TeO8_0_10.avi,jet is takeing off from inside sea
3chNlP5TeO8_0_10.avi,the racket is flying them
3chNlP5TeO8_0_10.avi,missile comes out of the sea with force and moved towards the upward direction
3chNlP5TeO8_0_10.avi,jet talking off from under the sea
3chNlP5TeO8_0_10.avi,jet plane appears to fly out of the sea
3chNlP5TeO8_0_10.avi,the jet flew out of the ocean
3chNlP5TeO8_0_10.avi,war flight is taking off
3chNlP5TeO8_0_10.avi,plane is flaying
3chNlP5TeO8_0_10.avi,plane is shooting out of the water and into the air
3chNlP5TeO8_0_10.avi,rocket is flying
3chNlP5TeO8_0_10.avi,rocket rises out of the ocean into the sky
3chNlP5TeO8_0_10.avi,here you can see the multimedia fighter jet in action
kWLNZzuo3do_154_165.avi,someone cuts off the tail of peeled shrimp and cuts into it lengthwise
kWLNZzuo3do_154_165.avi,someone is peeling prawn
kWLNZzuo3do_154_165.avi,woman butterflies shrimp
kWLNZzuo3do_154_165.avi,woman is cutting shrimps
kWLNZzuo3do_154_165.avi,person cuts up piece of seafood
kWLNZzuo3do_154_165.avi,someone is cutting and cleaning shrimp
kWLNZzuo3do_154_165.avi,woman is preparing some shrimp
kWLNZzuo3do_154_165.avi,the lady cut the tail off the shrimp and sliced the whole shrimps body
kWLNZzuo3do_154_165.avi,the woman is removing the tail and deveining the shrimp
kWLNZzuo3do_154_165.avi,woman cuts shrimp
kWLNZzuo3do_154_165.avi,the lady cut the shrimp
kWLNZzuo3do_154_165.avi,the person is clean the firsh
kWLNZzuo3do_154_165.avi,person is cleaning the prawn
kWLNZzuo3do_154_165.avi,how to make nadeyaki noodle
kWLNZzuo3do_154_165.avi,the person is cutting shrimp
kWLNZzuo3do_154_165.avi,man is cutting something
kWLNZzuo3do_154_165.avi,someone is cutting up piece of shrimp
kWLNZzuo3do_154_165.avi,how to make nabeyahi udon noodle soup
kWLNZzuo3do_154_165.avi,chef cleaning prawns
kWLNZzuo3do_154_165.avi,women is making the noodles with her dog
kWLNZzuo3do_154_165.avi,the woman is removing the shrimp tail
Xxcv5jvRmcg_39_46.avi,woman picks lobster from box
Xxcv5jvRmcg_39_46.avi,man women showing how to choose live lobster
Xxcv5jvRmcg_39_46.avi,man and woman pick lobster out of box
Xxcv5jvRmcg_39_46.avi,woman is holding lobster
Xxcv5jvRmcg_39_46.avi,woman is picking lobster for cooking
Xxcv5jvRmcg_39_46.avi,woman picks lobster from box of lobsters
Xxcv5jvRmcg_39_46.avi,woman picks up lobster
Xxcv5jvRmcg_39_46.avi,woman picks up and holds large lobster in her left hand standing next to box containing lobsters
Xxcv5jvRmcg_39_46.avi,people are feeling lobster
Xxcv5jvRmcg_39_46.avi,the cooks showed off the lobsters
Xxcv5jvRmcg_39_46.avi,the peole lifted up the lobsters
Xxcv5jvRmcg_39_46.avi,the people are looking at lobsters
Xxcv5jvRmcg_39_46.avi,two women are picking out lobsters
Xxcv5jvRmcg_39_46.avi,two women are touching lobsters
Xxcv5jvRmcg_39_46.avi,two women select lobster out of box of lobsters
Xxcv5jvRmcg_39_46.avi,girll is holding crag in his hand
Xxcv5jvRmcg_39_46.avi,lady is holding big lobster
Xxcv5jvRmcg_39_46.avi,man and woman are chatting
Xxcv5jvRmcg_39_46.avi,men and women with lobster
Xxcv5jvRmcg_39_46.avi,woman picked lobster out of box
Xxcv5jvRmcg_39_46.avi,woman telling about cooking
Xxcv5jvRmcg_39_46.avi,he is fishes on the take this
Xxcv5jvRmcg_39_46.avi,how to cook lobster
Xxcv5jvRmcg_39_46.avi,how to cut lobster
Xxcv5jvRmcg_39_46.avi,she teaches how to make how to cook lobster
Xxcv5jvRmcg_39_46.avi,two people are looking and holding lobsters
Xxcv5jvRmcg_39_46.avi,two persons are showing the crabs
Xxcv5jvRmcg_39_46.avi,cooking labster
Xxcv5jvRmcg_39_46.avi,girl is explain to cook lobster
Xxcv5jvRmcg_39_46.avi,lady chef is showing the method of cooking lobster
Xxcv5jvRmcg_39_46.avi,lady holding up lobster
Xxcv5jvRmcg_39_46.avi,lady is picking lobstar
Xxcv5jvRmcg_39_46.avi,man and lady explain how to select lobster
Xxcv5jvRmcg_39_46.avi,man and woman are looking at lobsters
Xxcv5jvRmcg_39_46.avi,woman holds up lobster
Xxcv5jvRmcg_39_46.avi,woman is picking out lobster
Xxcv5jvRmcg_39_46.avi,woman is telling how to cook lobster
Xxcv5jvRmcg_39_46.avi,woman picks out lobster from cardboard box
Xxcv5jvRmcg_39_46.avi,woman picks up live lobster
Xxcv5jvRmcg_39_46.avi,people are holding lobster
Xxcv5jvRmcg_39_46.avi,people are picking up lobster
Xxcv5jvRmcg_39_46.avi,the women is catching something
Xxcv5jvRmcg_39_46.avi,two chefs are examining live lobsters in box
Xxcv5jvRmcg_39_46.avi,two ladies selecting lobsters
Xxcv5jvRmcg_39_46.avi,two people are discussing about lobster
Xxcv5jvRmcg_39_46.avi,two people handle lobster
Xxcv5jvRmcg_39_46.avi,two woman talking about lobsters
Xxcv5jvRmcg_39_46.avi,two women discussing about cooking lobster
Xxcv5jvRmcg_39_46.avi,two women touch and inspect lobsters
Xxcv5jvRmcg_39_46.avi,two women touching lobsters
Xxcv5jvRmcg_39_46.avi,lobsters in the box
sBjr8UJOpsQ_149_169.avi,man and woman are dancing near waterfall
sBjr8UJOpsQ_149_169.avi,man and woman dance near waterfalls
sBjr8UJOpsQ_149_169.avi,man and woman is dancing in the water
sBjr8UJOpsQ_149_169.avi,couple are dancing near waterfall
sBjr8UJOpsQ_149_169.avi,man and woman are dancing near waterfall
sBjr8UJOpsQ_149_169.avi,man and woman are dancing in front of waterfall
sBjr8UJOpsQ_149_169.avi,man and woman dance in front of waterfall
sBjr8UJOpsQ_149_169.avi,man and woman are dancing in the water
sBjr8UJOpsQ_149_169.avi,man and woman are dancing in the rain in the open in song sequence against the backdrop of waterfall
sBjr8UJOpsQ_149_169.avi,the couple danced by the waterfall
sBjr8UJOpsQ_149_169.avi,man and woman dance in front of waterfall
sBjr8UJOpsQ_149_169.avi,the dancers danced by the waterfall
sBjr8UJOpsQ_149_169.avi,the women is playing in the rain
sBjr8UJOpsQ_149_169.avi,hero and heroin are dancing in song sequence
sBjr8UJOpsQ_149_169.avi,hero and the heroine are dancing for the song
sBjr8UJOpsQ_149_169.avi,the couple are dancing
sBjr8UJOpsQ_149_169.avi,karthick and thamana were dancing
sBjr8UJOpsQ_149_169.avi,couple playing in rain
sBjr8UJOpsQ_149_169.avi,couple are dancing near water falls
sBjr8UJOpsQ_149_169.avi,dance in the rain
sBjr8UJOpsQ_149_169.avi,young couple singing and dancing
sBjr8UJOpsQ_149_169.avi,couple is dancing
sBjr8UJOpsQ_149_169.avi,two people are dancing in front of waterfall
sBjr8UJOpsQ_149_169.avi,man and woman dance beside waterfall
6t0BpjwYKco_80_84.avi,woman grates carrot
6t0BpjwYKco_80_84.avi,woman is grating carrot into bowl
6t0BpjwYKco_80_84.avi,woman is shredding carrot
6t0BpjwYKco_80_84.avi,woman is grating sweet potato
6t0BpjwYKco_80_84.avi,woman is grating carrot
6t0BpjwYKco_80_84.avi,woman is scraping carrot
6t0BpjwYKco_80_84.avi,woman is grating an orange food
6t0BpjwYKco_80_84.avi,woman is grating carrots
6t0BpjwYKco_80_84.avi,someone is greating carrot
6t0BpjwYKco_80_84.avi,the lady grated carrot into the bowl
6t0BpjwYKco_80_84.avi,the woman is grating carrot
6t0BpjwYKco_80_84.avi,the lady grated carrot
6t0BpjwYKco_80_84.avi,the women is preparing curry
6t0BpjwYKco_80_84.avi,woman is grading and orange
6t0BpjwYKco_80_84.avi,lady cutting the slices of tomaato
6t0BpjwYKco_80_84.avi,woman grating carrot
6t0BpjwYKco_80_84.avi,cooking with dog show demonstrates how to make katsu curry
6t0BpjwYKco_80_84.avi,woman coking
6t0BpjwYKco_80_84.avi,woman is grating vegetable
6t0BpjwYKco_80_84.avi,japan china and korea language and culture with religion not with quite different
6t0BpjwYKco_80_84.avi,someone grates carrot
TdYN7cePiRI_6_13.avi,very muscular man is lifting barbells
TdYN7cePiRI_6_13.avi,man is doing exercise by weightlifter
TdYN7cePiRI_6_13.avi,man bench presses weights
TdYN7cePiRI_6_13.avi,man lying on his back in gym is lifting weights
TdYN7cePiRI_6_13.avi,the man bench pressed heavy weight
TdYN7cePiRI_6_13.avi,body builder is bench pressing
TdYN7cePiRI_6_13.avi,bodybuilder lifts weights
TdYN7cePiRI_6_13.avi,mand bench pressed heavy weight
TdYN7cePiRI_6_13.avi,the man is doing body building exercises
TdYN7cePiRI_6_13.avi,man is doing execercise in jim
TdYN7cePiRI_6_13.avi,body builder make they body fit
TdYN7cePiRI_6_13.avi,hulk displaying his muscles
TdYN7cePiRI_6_13.avi,nice body structure
TdYN7cePiRI_6_13.avi,the man builds his body
TdYN7cePiRI_6_13.avi,man is doing exercises to build up his body
TdYN7cePiRI_6_13.avi,huge ripped guys benching some weight
TdYN7cePiRI_6_13.avi,man doing exercise
TdYN7cePiRI_6_13.avi,bodybuilder lifts weights
TdYN7cePiRI_6_13.avi,man lifting weight to make muscles in gym
TdYN7cePiRI_6_13.avi,super bodybuilding muscle mans video
TdYN7cePiRI_6_13.avi,man is bench pressing weights
TdYN7cePiRI_6_13.avi,person is doing execise
MW21lp833Vo_143_149.avi,man is crying while tying rope into noose
MW21lp833Vo_143_149.avi,man ties noose
MW21lp833Vo_143_149.avi,man is tying noose
MW21lp833Vo_143_149.avi,man is making hangmans noose out of rope
MW21lp833Vo_143_149.avi,man binding knot
MW21lp833Vo_143_149.avi,man is preparing hanging rope
MW21lp833Vo_143_149.avi,man makes noose
MW21lp833Vo_143_149.avi,man is making noose
MW21lp833Vo_143_149.avi,the man made noose out of the yellow rope
MW21lp833Vo_143_149.avi,the man is making hangmans noose
MW21lp833Vo_143_149.avi,man winds up some rope
MW21lp833Vo_143_149.avi,the man made noose out of yellow rope
MW21lp833Vo_143_149.avi,man crying and trying to hang himself through rope
MW21lp833Vo_143_149.avi,man playing with rope
MW21lp833Vo_143_149.avi,man is crying to made an suicide
MW21lp833Vo_143_149.avi,man is going to die
MW21lp833Vo_143_149.avi,man is making hangmans noose
MW21lp833Vo_143_149.avi,man is tying rope
MW21lp833Vo_143_149.avi,man is tying knots with rope
MW21lp833Vo_143_149.avi,rolling rope
MW21lp833Vo_143_149.avi,man is ready rope
MW21lp833Vo_143_149.avi,the person is eating something
MdOAr_4FJvc_5_15.avi,man seated is playing piano
MdOAr_4FJvc_5_15.avi,david sides playing piano
MdOAr_4FJvc_5_15.avi,the person is playing the key board
MdOAr_4FJvc_5_15.avi,young man playing the piano
MdOAr_4FJvc_5_15.avi,the man is playing the piano
MdOAr_4FJvc_5_15.avi,man is playing music on piano
MdOAr_4FJvc_5_15.avi,man playing pianon with soft hand
MdOAr_4FJvc_5_15.avi,guy is playing piano
MdOAr_4FJvc_5_15.avi,he is playing phiyano
MdOAr_4FJvc_5_15.avi,men is playing the piano
MdOAr_4FJvc_5_15.avi,very super piano music video
HkpUWzNNVt4_20_30.avi,two couples are interacting
HkpUWzNNVt4_20_30.avi,two couple are talking with each other
HkpUWzNNVt4_20_30.avi,two couples are talking in the living room
HkpUWzNNVt4_20_30.avi,two couples are talking each other
HkpUWzNNVt4_20_30.avi,two couple are talking to each other
HkpUWzNNVt4_20_30.avi,two young couples talk to each other
HkpUWzNNVt4_20_30.avi,two couples are talking with each other
HkpUWzNNVt4_20_30.avi,two ladies are talking to each other sitting on opposite sides with their respective spouses
HkpUWzNNVt4_20_30.avi,couples on dating show
HkpUWzNNVt4_20_30.avi,the couples talked to each other about their engagements
HkpUWzNNVt4_20_30.avi,couples sit and talk
HkpUWzNNVt4_20_30.avi,the women are talking
HkpUWzNNVt4_20_30.avi,two couples are sitting and talking
HkpUWzNNVt4_20_30.avi,couples were talking about their engagements
HkpUWzNNVt4_20_30.avi,boy and girl talking
HkpUWzNNVt4_20_30.avi,tele novella seriously sally about young couple who meets new neighbors
HkpUWzNNVt4_20_30.avi,boyes and girls talking on the seet
HkpUWzNNVt4_20_30.avi,men and women given interview
HkpUWzNNVt4_20_30.avi,they are new neighbors
HkpUWzNNVt4_20_30.avi,two couple gossiping to each other
HkpUWzNNVt4_20_30.avi,two couples are taking to each other
HkpUWzNNVt4_20_30.avi,two couples are talking
HkpUWzNNVt4_20_30.avi,two cuple sitting their
HkpUWzNNVt4_20_30.avi,two neighbours talking to each other
HkpUWzNNVt4_20_30.avi,couple are talking
HkpUWzNNVt4_20_30.avi,couple meets their neighbors for the first time and it is far from pleasant
HkpUWzNNVt4_20_30.avi,man and woman sitting on sofa
HkpUWzNNVt4_20_30.avi,man and woman sitting on the sofa
HkpUWzNNVt4_20_30.avi,woman and man talking to each other
HkpUWzNNVt4_20_30.avi,woman is talking to another woman
HkpUWzNNVt4_20_30.avi,young man and young woman chatting
HkpUWzNNVt4_20_30.avi,cute couples
HkpUWzNNVt4_20_30.avi,men and women were chatting with one another
HkpUWzNNVt4_20_30.avi,some people on couches talking
HkpUWzNNVt4_20_30.avi,the girls of two couples are talking to each other
HkpUWzNNVt4_20_30.avi,tow women with two men talking each other
HkpUWzNNVt4_20_30.avi,two couples are talking to each other
HkpUWzNNVt4_20_30.avi,two couples discuss
HkpUWzNNVt4_20_30.avi,two couples sitting and gossiping with each other
HkpUWzNNVt4_20_30.avi,two couples talk
HkpUWzNNVt4_20_30.avi,two neighbors talking each other
HkpUWzNNVt4_20_30.avi,two young couple sharing conversation
HkpUWzNNVt4_20_30.avi,two young couples are sitting having conversation
HkpUWzNNVt4_20_30.avi,the girls says something
HkpUWzNNVt4_20_30.avi,the neighbors taking together
HkpUWzNNVt4_20_30.avi,two couples talking each other
4VLrxtf7Z_8_0_7.avi,someone riding horse is jumping hurdles
4VLrxtf7Z_8_0_7.avi,woman riding horse leaps over hurdle
4VLrxtf7Z_8_0_7.avi,horse jumps over an obstacle
4VLrxtf7Z_8_0_7.avi,man riding horse is jumping over obstacles
4VLrxtf7Z_8_0_7.avi,woman is doing stunts while riding horse
4VLrxtf7Z_8_0_7.avi,woman is riding horse over hurdles
4VLrxtf7Z_8_0_7.avi,woman on horseback jumps hurdle
4VLrxtf7Z_8_0_7.avi,horse and rider are jumping obstacles on course
4VLrxtf7Z_8_0_7.avi,girl is jumping her horse
4VLrxtf7Z_8_0_7.avi,horse and rider are running over jumps
4VLrxtf7Z_8_0_7.avi,the rider and horse jumped an obstacle
4VLrxtf7Z_8_0_7.avi,horse and rider jumps over obstacles
4VLrxtf7Z_8_0_7.avi,horse jumps over gate
4VLrxtf7Z_8_0_7.avi,the man is given practice to the horse
4VLrxtf7Z_8_0_7.avi,one man is riding on horse and showing some stunt
4VLrxtf7Z_8_0_7.avi,girl is riding on the horse
4VLrxtf7Z_8_0_7.avi,horse jumps over set of hurdles but hits the next set
4VLrxtf7Z_8_0_7.avi,the horse and rider jumped over the hurdles
4VLrxtf7Z_8_0_7.avi,woman riding horse jumps over hurdle
MSrJTeKNzdI_32_36.avi,someone is snow skiing down slope
MSrJTeKNzdI_32_36.avi,man is skiing down mountain
MSrJTeKNzdI_32_36.avi,person is skiing downhill
MSrJTeKNzdI_32_36.avi,someone is skiing down snow covered slope
MSrJTeKNzdI_32_36.avi,person is skiing in the ice
MSrJTeKNzdI_32_36.avi,person is skiing down large hill
MSrJTeKNzdI_32_36.avi,man is skating on ice
MSrJTeKNzdI_32_36.avi,skier is slaloming down hill
MSrJTeKNzdI_32_36.avi,person skis down hill
MSrJTeKNzdI_32_36.avi,someone is skiing downhill
MSrJTeKNzdI_32_36.avi,person is skiing
MSrJTeKNzdI_32_36.avi,person is snow skiing
MSrJTeKNzdI_32_36.avi,the man is skiing down the hill
MSrJTeKNzdI_32_36.avi,someone is downhill skiing
MSrJTeKNzdI_32_36.avi,person skis down mountain
MSrJTeKNzdI_32_36.avi,someone is skiing down snow covered hill
MSrJTeKNzdI_32_36.avi,man ice skiing
MSrJTeKNzdI_32_36.avi,the persons are playing in the snow with scatting
MSrJTeKNzdI_32_36.avi,man is skiing down hill
MSrJTeKNzdI_32_36.avi,the player is playing the sketes over the snow and he is moving very speedly
MSrJTeKNzdI_32_36.avi,man is doing ice sketing
MSrJTeKNzdI_32_36.avi,person is playing the snow leopard game
MSrJTeKNzdI_32_36.avi,man is skating on ice
MSrJTeKNzdI_32_36.avi,the man skiied down the mountain
HypgcCT1r68_38_46.avi,female teacher reads to the class
HypgcCT1r68_38_46.avi,female teacher is reading out loud from piece of paper
HypgcCT1r68_38_46.avi,teacher is reading letter in her class
HypgcCT1r68_38_46.avi,teacher is reading aloud from paper
HypgcCT1r68_38_46.avi,teacher read paper to the class
HypgcCT1r68_38_46.avi,teacher reads aloud from piece of paper
HypgcCT1r68_38_46.avi,teacher reads to her class
HypgcCT1r68_38_46.avi,woman is holding sheet of paper and reading the text
HypgcCT1r68_38_46.avi,woman is reading paper aloud
HypgcCT1r68_38_46.avi,woman is reading piece of paper
HypgcCT1r68_38_46.avi,woman is reading out loud
HypgcCT1r68_38_46.avi,the teacher is reading the paper
HypgcCT1r68_38_46.avi,the teacher read from paper to the class
HypgcCT1r68_38_46.avi,teacher is reading to the class
HypgcCT1r68_38_46.avi,the teacher is reading to her students
HypgcCT1r68_38_46.avi,little boy is caught passing love note in class
HypgcCT1r68_38_46.avi,teacher is reading something from piece of notebook paper
HypgcCT1r68_38_46.avi,teacher reads letter in class
HypgcCT1r68_38_46.avi,the teacher is reading paper in the classroom while the children watch
HypgcCT1r68_38_46.avi,woman reading aloud
HypgcCT1r68_38_46.avi,teacher is reading something in class
HypgcCT1r68_38_46.avi,children interacting
HypgcCT1r68_38_46.avi,teacher taking class and interacting with students
HypgcCT1r68_38_46.avi,woman teacher is reading
HypgcCT1r68_38_46.avi,teacher is reading letter
HypgcCT1r68_38_46.avi,one teacher reading some letter
HypgcCT1r68_38_46.avi,boy express his feeling to his class mate
HypgcCT1r68_38_46.avi,the children are studying in the class room
HypgcCT1r68_38_46.avi,teacher read paper and smiled on it
HypgcCT1r68_38_46.avi,woman is reading document
HypgcCT1r68_38_46.avi,teacher reads from piece of paper
HypgcCT1r68_38_46.avi,woman is reading
HypgcCT1r68_38_46.avi,teacher is reading paper
HypgcCT1r68_38_46.avi,teacher is reading note to her classroom
HypgcCT1r68_38_46.avi,teacher is teaching lesson two students
HypgcCT1r68_38_46.avi,teacher is teaching lesson
HypgcCT1r68_38_46.avi,child in classroom writes not to little girlfriend and teacher reads it out loud
HypgcCT1r68_38_46.avi,teacher is reading something infront of their students
HypgcCT1r68_38_46.avi,girl is reading letter
HypgcCT1r68_38_46.avi,woman is reading letter
HypgcCT1r68_38_46.avi,lady is reading paper
HypgcCT1r68_38_46.avi,woman is reading from piece of paper
HypgcCT1r68_38_46.avi,lady teacher is teaching
HypgcCT1r68_38_46.avi,teacher in classroom reading some kind of letter or an article
HypgcCT1r68_38_46.avi,teacher is reading aloud
HypgcCT1r68_38_46.avi,teacher reads paper to the class
HypgcCT1r68_38_46.avi,teacher is reading out paper in class
HypgcCT1r68_38_46.avi,the teacher read an essay to the class
HypgcCT1r68_38_46.avi,in commercial boy is caught passing love note
HypgcCT1r68_38_46.avi,the woman is reading paper
HypgcCT1r68_38_46.avi,woman reads her paper in front of class
HypgcCT1r68_38_46.avi,teacher is reading to her class from piece of notebook paper
HypgcCT1r68_38_46.avi,the teacher read paper to the class
b97TK8XVLHE_40_50.avi,man is smiling as he reads an email message
b97TK8XVLHE_40_50.avi,man checks his email
b97TK8XVLHE_40_50.avi,man is checking his email
b97TK8XVLHE_40_50.avi,man is staring straight ahead and rubbing his hand over his chin and then the scene switches to personal ad in some kind of paper or magazine
b97TK8XVLHE_40_50.avi,man is reading message on computer
b97TK8XVLHE_40_50.avi,man is reading romantic email message on computer
b97TK8XVLHE_40_50.avi,man is smiling
b97TK8XVLHE_40_50.avi,man is rubbing his face and reading
b97TK8XVLHE_40_50.avi,man is reading his email
b97TK8XVLHE_40_50.avi,someone is reading an email
b97TK8XVLHE_40_50.avi,man is reading an email
b97TK8XVLHE_40_50.avi,the man read personals ad
b97TK8XVLHE_40_50.avi,the man is reading his email
b97TK8XVLHE_40_50.avi,man is reading an email message
b97TK8XVLHE_40_50.avi,man reads his email
b97TK8XVLHE_40_50.avi,the man read an ad from personals ad
b97TK8XVLHE_40_50.avi,man is talking to someone on his computer
b97TK8XVLHE_40_50.avi,man operating coumpter
b97TK8XVLHE_40_50.avi,someone typing in the computer
b97TK8XVLHE_40_50.avi,the person is reading the something
b97TK8XVLHE_40_50.avi,man rubs his chin while reading email
b97TK8XVLHE_40_50.avi,man reading letter excitedely
b97TK8XVLHE_40_50.avi,the man is reading his email
b97TK8XVLHE_40_50.avi,the man checking his mail in the system
b97TK8XVLHE_40_50.avi,man reading the message in his computer sent by his girl friend
nTUONeDqhdk_10_15.avi,baby is on football dress
nTUONeDqhdk_10_15.avi,baby is walking and falls over
nTUONeDqhdk_10_15.avi,boy playing goalie falls down
nTUONeDqhdk_10_15.avi,child in ice hockey goalie equipment falls over
nTUONeDqhdk_10_15.avi,child is trying to walk in over sized hockey equipment
nTUONeDqhdk_10_15.avi,child wearing sports gear is falling over
nTUONeDqhdk_10_15.avi,kid dressed in hockey gear falls over
